taskId,language,description,topic_id,word_count
3118,7c7EfWGr3TJ78QMCSI0U6J_RS,EN,dylan abbi stay togeth happen next write last paragraph bodi bodi away lachanc three friend learn boy area state main disappear probabl dead decid go trip find boy bodi prepar trip gun room second floor realli hot glad sleep night think go excit roll two blanket tie old belt around grab money less dollar readi go go back stair avoid meet dad walk carbin street toward clubhous catch eye shine gordi want someth sure come first point alley two shop come ran alley run bottom smell trash terribl go puke forgot smell put hand backpack pull big gun dad desk man dad go beat find eye go danc go find friend enough wine keep drunk week put back hate alcohol alreadi much one we drink despain brother bring beer steal father bullet nine left box think shoot bottl drunk moment cour think final take gun heavi way sit hand point gun larg tin smelli trash spill squeez ka blam gun jump hand fire shot end feel wrist break heart mouth big hole appear tin work evil magician wow scream laugh wildli tell amus scare gordi lachanc shoot castl rock piec care everyon come gordi shut let go scream grab shirt give gun push backpack run alley reach carbin street slow walk one would notic we hear nois gun still laugh man piti face oh man realli great knew bullet mean trick realli know gordi honestli take dad desk alway take bullet guess drunk rememb last time look innoc babi clubhous find vern teddi wait start laugh tell whole stori everyon good laugh teddi ask think need gun noth realli except might wild anim anyway frighten forest night everyon agre strong brave guy we thing put tent field teddi ask vern yeah put two lamp turn look dark hey man great slap vern back real think grin let go teddi nearli twelv alreadi stand gather round walk across beeman field railway track walk across bridg harlow far think teddi ask know harlow big go walk least twenti mile sound right gordi yeah mayb thirti mile come guy pick backpack blanket water bottl healthi activ thanksgiv healthi activ thanksgiv headlin write pam warner publish health style author date sourc thanksgiv turkey pumpkin pie american footbal sofa last coupl year new trend becom popular usa peopl eat well qualiti food live activ life introduct slowli go fashion live conveni frozen food number peopl shop organ food special supermarket instead state farmer market offer great varieti fresh veget fruit region also dairi product bread meat without chemic addit market organ food much healthy tast lot well well explain emma boston healthi recip thanksgiv mayb pumpkin soup mash sweet potato roast turkey breast turkey roulad fill appl cranberri delici healthi lifestyl food lot trend sport show fun spend time friend stay fit time find right sport yet suggest standup paddleboard water ideal kind sport stand board paddl move water worri travel sea lot club offer standup paddleboard lake river cour live healthi also mean avoid alcohol drug finn fit instructor cleveland drink much alcohol good health alcohol drink lot calori neg effect fit tri smoothi instead drug even wor easili addict often caus problem famili school main part sum organ food togeth sport great way stay fit without favorit meal chang lifestyl bit much happy person conclus first date dylan often think abbi realli shi ask date dylan friend forget interest boyfriend one day book fall locker right abbi show scott tow cours embarrass scott guy look day later lunch togeth dylan help abbi scienc project notic scott footbal friend scott friend girlfriend dylan let explain hard dylan go gym boy attack scott push realli hard dylan anyth scott stay gordi abbi stop hurt day later dylan ask abbi come danc ye nervou pick abbi dad young man must dylan parti great everybodi enjoy music danc big surpris even dylan abbi proud present proudli present year homecom king queen end even dylan take abbi home perfect moment abbi dad excus,,665
3119,5vRqn9PxMfcasYn6JnuIfb_RS,EN,live without electr write short text give three reason question live live without electr also think anoth reason exampl work group three one read text other two comment posit reason text take turn phrase agre think right wrong true think bodi bodi gordi lachanc three friend learn boy area state main disappear probabl dead decid go trip find boy bodi prepar trip gun room second floor realli hot glad sleep night think go excit roll two blanket tie old belt around grab money less dollar readi go go back stair avoid meet dad walk carbin street toward clubhous catch eye shine gordi want someth sure come first point alley two shop come ran alley run bottom smell trash terribl go puke forgot smell put hand backpack pull big gun dad desk man dad go beat find eye go danc go find friend enough wine keep drunk week put back hate alcohol alreadi much one we drink despain brother bring beer steal father bullet nine left box think shoot bottl drunk moment cour think final take gun heavi way sit hand point gun tin smelli trash spill squeez ka blam gun jump hand fire shot end feel wrist break heart mouth big hole appear tin work evil magician wow scream laugh wildli tell amus scare gordi lachanc shoot castl rock piec care everyon come gordi shut let go scream grab shirt give gun push backpack run alley reach carbin street slow walk one would notic we hear nois gun still laugh man piti face oh man realli great knew bullet mean trick realli know gordi honestli take dad desk alway take bullet guess drunk rememb last time look innoc babi clubhous find vern teddi wait start laugh tell whole stori everyon good laugh teddi ask think need gun noth realli except might wild anim anyway frighten forest night everyon agre strong brave guy we thing put tent field teddi ask vern yeah put two lamp turn look dark hey man great slap vern back real think grin let go teddi nearli twelv alreadi stand gather round walk across beeman field railway track walk across bridg harlow far think teddi ask know harlow big go walk least twenti mile sound right gordi yeah mayb thirti mile come guy pick backpack blanket water bottl healthi activ thanksgiv healthi activ thanksgiv headlin write pam warner publish health style author date sourc thanksgiv turkey pumpkin pie american footbal sofa last coupl year new trend becom popular usa peopl eat well qualiti food live activ life introduct slowli go fashion live conveni frozen food number peopl shop organ food special supermarket instead state farmer market offer great varieti fresh veget fruit region also dairi product bread meat without chemic addit market organ food much healthy tast lot well well explain emma boston healthi recip thanksgiv mayb pumpkin soup mash sweet potato roast turkey breast turkey roulad fill appl cranberri delici healthi lifestyl food lot trend sport show fun spend time friend stay fit time find right sport yet suggest standup paddleboard water ideal kind sport stand board paddl move water worri travel sea lot club offer standup paddleboard lake river cour live healthi also mean avoid alcohol drug finn fit instructor cleveland drink much alcohol good health alcohol drink lot calori neg effect fit tri smoothi instead drug even wor easili addict often caus problem famili school main part sum organ food togeth sport great way stay fit without favorit meal chang lifestyl bit much happy person conclus first date dylan often think abbi realli shi ask date dylan friend forget interest boyfriend one day book fall locker right abbi show scott tow cours embarrass scott guy look day later lunch togeth dylan help abbi scienc project notic scott footbal friend scott friend girlfriend dylan let explain hard dylan go gym boy attack scott push realli hard dylan anyth scott stay away abbi stop hurt day later dylan ask abbi come danc ye nervou pick abbi dad young man must dylan parti great everybodi enjoy music danc big surpris even dylan abbi proud present proudli present year homecom king larg queen end even dylan take abbi home perfect moment abbi dad excus,,696
3120,4JJt44MdjWH88z5F0nMA5j_RS,EN,great mistak noth littl sydney smith explain mean quot discuss agre bodi bodi gordi lachanc three friend learn boy area state main disappear probabl dead decid go trip find boy bodi prepar trip gun room second floor realli hot glad sleep night think go excit roll two blanket tie old belt around grab money less laugh dollar readi go go back stair avoid meet dad walk carbin street toward clubhous catch eye shine gordi want someth sure come first point alley two shop come ran alley run bottom smell trash terribl go puke forgot smell put hand backpack pull big gun dad desk man dad go beat find eye go danc go find friend enough wine keep drunk week put back hate alcohol alreadi much one we drink despain brother bring beer steal father bullet nine left box think shoot bottl drunk moment cour think final take gun heavi way sit hand point gun larg tin smelli trash spill squeez ka blam gun jump hand fire shot end feel wrist break heart mouth big hole appear tin work evil magician wow scream wildli tell amus scare gordi lachanc shoot castl rock piec care everyon come gordi shut let go scream grab shirt give gun push backpack run alley reach carbin street slow walk one would notic we hear nois gun still laugh man piti face oh man realli great knew bullet mean trick realli know gordi honestli take dad desk alway take bullet guess drunk rememb last time look innoc babi clubhous find vern teddi wait start laugh tell whole stori everyon good laugh teddi ask think need gun noth realli except might wild anim anyway frighten forest night everyon agre strong brave guy we thing put tent field teddi ask vern yeah put two lamp turn look dark hey man great slap vern back real think grin let go teddi nearli twelv alreadi stand gather round walk across beeman field railway track walk across bridg harlow far think teddi ask know harlow big go walk least twenti mile sound right gordi yeah mayb thirti mile come guy pick backpack blanket water bottl healthi activ thanksgiv healthi activ thanksgiv headlin write pam warner publish health style author date sourc thanksgiv turkey pumpkin pie american footbal sofa last coupl year new trend becom popular usa peopl eat well qualiti food live activ life introduct slowli go fashion live conveni frozen food number peopl shop organ food special supermarket instead state farmer market offer great varieti fresh veget fruit region also dairi product bread meat without chemic addit market organ food much healthy tast lot well well explain emma boston healthi recip thanksgiv mayb pumpkin soup mash sweet potato roast turkey breast turkey roulad fill appl cranberri delici healthi lifestyl food lot trend sport show fun spend time friend stay fit time find right sport yet suggest standup paddleboard water ideal kind sport stand board paddl move water worri travel sea lot club offer standup paddleboard lake river cour live healthi also mean avoid alcohol drug finn fit instructor cleveland drink much alcohol good health alcohol drink lot calori neg effect fit tri smoothi instead drug even wor easili addict often caus problem famili school main part sum organ food togeth sport great way stay fit without favorit meal chang lifestyl bit much happy person conclus first date dylan often think abbi realli shi ask date dylan friend forget interest boyfriend one day book fall locker right abbi show scott tow cours embarrass scott guy look day later lunch togeth dylan help abbi scienc project notic scott footbal friend scott friend girlfriend dylan let explain hard dylan go gym boy attack scott push realli hard dylan anyth scott stay away abbi stop hurt day later dylan ask abbi come danc ye nervou pick abbi dad young man must dylan parti great everybodi enjoy music danc big surpris even dylan abbi proud present proudli present year homecom king queen end even dylan take abbi home perfect moment abbi dad excus,,667
3121,15sKzdWMaXB8f0Mx9Aomk1_RS,EN,collect inform jose find text live dream write articl jose help jose blanco basebal player big futur peopl tell we einleitung da wichtigst uber die person interess beim leser wecken jose immigr parent home countri jose dad jose live good start take basebal serious becom want hauptteil detail zur person would meet jose write we win ticket next basebal match interessant schluss z b frage oder aufforderung leser leserin bodi bodi gordi lachanc three friend learn boy area state main disappear probabl dead decid go trip find boy bodi prepar trip gun room second floor realli hot glad sleep night think go excit roll two blanket tie old belt around grab money less dollar readi go go back stair avoid meet dad walk carbin street toward clubhous catch eye shine gordi want someth sure come first point alley two shop come ran alley run bottom smell trash terribl go puke forgot smell put hand backpack pull big gun dad desk man dad go beat find eye go danc go find friend enough wine keep drunk week put back hate alcohol alreadi much one we drink despain brother bring beer steal father bullet nine left box think shoot bottl drunk moment cour think final take gun heavi way sit hand point gun larg tin smelli trash spill squeez ka blam gun jump hand fire shot end feel wrist break heart mouth big hole appear tin work evil magician wow scream laugh wildli tell amus scare gordi lachanc shoot castl rock piec care everyon come gordi shut let go scream grab shirt give gun push backpack run alley reach carbin street slow walk one would notic we hear nois gun still laugh man piti face oh man realli great knew bullet mean trick realli know gordi honestli take dad desk alway take bullet guess drunk rememb last time look innoc babi clubhous find vern teddi wait start laugh tell whole stori everyon good laugh teddi ask think need gun noth realli except might wild anim anyway frighten forest night everyon agre strong brave guy we thing put tent field teddi ask vern yeah put two lamp turn look dark hey man great slap vern back real think grin let go teddi nearli twelv alreadi stand gather round walk across beeman field railway track walk across bridg harlow far think teddi ask know harlow big go walk least twenti mile sound right gordi yeah mayb thirti mile come guy pick backpack blanket water bottl healthi activ thanksgiv healthi activ thanksgiv headlin write pam warner publish health style author date sourc thanksgiv turkey pumpkin pie american footbal sofa last coupl year new trend becom popular usa peopl eat well qualiti food live activ life introduct slowli go fashion live conveni frozen food number peopl shop organ food special supermarket instead state farmer market offer great varieti fresh veget fruit region also dairi product bread meat without chemic addit market organ food much healthy tast lot well well explain emma boston healthi recip thanksgiv mayb pumpkin soup mash sweet potato roast turkey breast turkey roulad fill appl cranberri delici healthi lifestyl food lot trend sport show fun spend time friend stay fit time find right sport yet suggest standup paddleboard water ideal kind sport stand board paddl move water worri travel sea lot club offer standup paddleboard lake river cour live healthi also mean avoid alcohol drug finn fit instructor cleveland drink much alcohol good health alcohol drink lot calori neg effect fit tri smoothi instead drug even wor easili addict often caus problem famili school main part sum organ food togeth sport great way stay fit without favorit meal chang lifestyl bit much happy person conclus first date dylan often think abbi realli shi ask date dylan friend forget interest boyfriend one day book fall locker right abbi show scott tow cours embarrass scott guy look day later lunch togeth dylan help abbi scienc project notic scott footbal friend scott friend girlfriend dylan let explain hard dylan go gym boy attack scott push realli hard dylan anyth scott stay away abbi stop hurt day later dylan ask abbi come danc ye nervou pick abbi dad young man must dylan parti great everybodi enjoy music danc big surpris even dylan abbi proud present proudli present year homecom king queen end even dylan take abbi home perfect moment abbi dad excus live dream interview hello jose ask question magazin plea jose hi sure interview new basebal team happi jose first three match complain interview lot player latin america immigr unit state jose twelv year ago ten interview big decis parent leave home move foreign place jose ye poor cuba father unemploy long time parent want give sister good chanc interview first year jose parent problem learn english school strong commun cuban new york parent open small shop immigr interview feel jose begin homesick miss friend parent give lot slowli new life interview begin basebal career jose take sport serious join basebal team high school success becom star team basebal career start lucki live dream peopl much hard interview plan futur jose us citizen home plan help peopl cuba interview thank time,,855
3122,9FHPtL8Lbn8uLdsqhCN4F_RS,EN,beantwort die fragen wie sind die gesetzlichen bestimmungen bodi bodi gordi lachanc three friend learn boy area state main disappear probabl dead decid go trip find boy bodi prepar trip gun room second floor realli hot glad sleep night think go excit roll two blanket tie old belt around grab money less dollar readi go go back stair avoid meet dad walk carbin street toward clubhous catch eye shine gordi want someth sure come first point alley two shop come ran alley run bottom smell trash terribl go puke forgot smell put hand backpack pull big gun dad desk man dad go beat find eye go danc go find friend enough wine keep drunk week put back hate alcohol alreadi much one we drink despain brother bring beer steal father bullet nine left box think shoot bottl drunk moment cour think final take gun heavi way sit hand point gun larg tin smelli trash spill squeez ka blam gun jump hand fire shot end feel wrist break heart mouth big hole appear tin work evil magician wow scream laugh wildli tell amus scare gordi lachanc shoot castl rock piec care everyon come gordi shut let go scream grab shirt give gun push backpack run alley reach carbin street slow walk one would notic we hear nois gun still laugh man piti face oh man realli great knew bullet mean trick realli know gordi honestli take dad desk alway take bullet guess drunk rememb last time look innoc babi clubhous find vern teddi wait start laugh tell whole stori everyon good laugh teddi ask think need gun noth realli except might wild anim anyway frighten forest night everyon agre strong brave guy we thing put tent field teddi ask vern yeah put two lamp turn look dark hey man great slap vern back real think grin let go teddi nearli twelv alreadi stand gather round walk across beeman field railway track walk across bridg harlow far think teddi ask know harlow big go walk least twenti mile sound right gordi yeah mayb thirti mile come guy pick backpack blanket water bottl healthi activ thanksgiv healthi activ thanksgiv headlin write pam warner publish health style author date sourc thanksgiv turkey pumpkin pie american footbal sofa last coupl year new trend becom popular usa peopl eat well qualiti food live activ life introduct slowli go fashion live conveni frozen food number peopl shop organ food special supermarket instead state farmer market offer great varieti fresh veget fruit region also dairi product bread meat without chemic addit market organ food much healthy tast lot well well explain emma boston healthi recip thanksgiv mayb pumpkin soup mash sweet potato roast turkey breast turkey roulad fill appl cranberri delici healthi lifestyl food lot trend sport show fun spend time friend stay fit time find right sport yet suggest standup paddleboard water ideal kind sport stand board paddl move water worri travel sea lot club offer standup paddleboard lake river cour live healthi also mean avoid alcohol drug finn fit instructor cleveland drink much alcohol good health alcohol drink lot calori neg effect fit tri smoothi instead drug even wor easili addict often caus problem famili school main part sum organ food togeth sport great way stay fit without favorit meal chang lifestyl bit much happy person conclus first date dylan often think abbi realli shi ask date dylan friend forget interest boyfriend one day book fall locker right abbi show scott tow cours embarrass scott guy look day later lunch togeth dylan help abbi scienc project notic scott footbal friend scott friend girlfriend dylan let explain hard dylan go gym boy attack scott push realli hard dylan anyth scott stay away abbi stop hurt day later dylan ask abbi come danc ye nervou pick abbi dad young man must dylan parti great everybodi enjoy music danc big surpris even dylan abbi proud present proudli present year homecom king queen end even dylan take abbi home perfect moment abbi dad excus live dream interview hello jose ask question magazin plea jose hi sure interview new basebal team happi jose first three match complain interview lot player latin america immigr unit state jose twelv year ago ten interview big decis parent leave home move foreign place jose ye poor cuba father unemploy long time parent want give sister good chanc interview first year jose parent problem learn english school strong commun cuban new york parent open small shop immigr interview feel jose begin homesick miss friend parent give lot slowli new life interview begin basebal career jose take sport serious join basebal team high school success becom star team basebal career start lucki live dream peopl much hard interview plan futur jose us citizen home plan help peopl cuba interview thank time young work mani big farm california employ child mostli latin america pick fruit veget child help parent earn live migrant parent often enough incom difficult well job mani mani qualif hardli speak english even usa illeg labor legal right take break water drink state california realiti thing differ fresno weekli magazin talk matteo brother ramon sacramento work differ farm fresno weekli work condit matteo morn buse drive we field work day heat sometim work ten hour day earn minimum wage even less long hour field tire fresno weekli ramon long work field ramon sinc ten dad fresno weekli health problem ramon ye pesticid alway difficulti breath constant headach peopl injur work larg machin feder law allow farm owner employ child age twelv big farm even young child small farm age teenag farm work without parent consent offici allow work outsid school hour even finish high school statist mani child spend day farm helper estim half million recent attempt chang law fail,,955
3123,4JbleLRfJVb7fw0HOwrJH8_RS,EN,give well advic friend parent give opinion write opinion,,9
3124,ay8t0XBC8PZ9WvMzDX0EpW_RS,EN,link leave ad word sentenc suddenli yesterday driver clean bu lunch listen news radio talk wife phone minut later bu arriv redhil privat school sentenc school ten minut later car hit bu near umlazi township,,35
3125,5s8399RbkWI8GvGTjOnr8e_RS,EN,talk social differ peopl situat discuss idea class start mayb woman first photo girl second photo word good job lose job rich husband run away home,,26
3126,8mZsoep8FuD5yNROtdXExC_RS,EN,note partner free time talk,,5
3127,4fHzBC8AGaM6WS2QwbGMt3_RS,EN,look structur text even well author finish even well lindsay fern countri rich natur resourc ga oil wood water canada also world leader natur resourc produc energi compar countri quit well come modern technolog renew energi canada produc ten percent world electr produc water power enough canada mainli reli tradit resourc natur ga oil energi last coupl year technolog improv much today access oil ga reserv avail way exploit natur resourc come particular problem serious affect environ good exampl frack mixtur chemic sand huge amount water mixtur push grind great pressur order break open rock hold ga ga rise collect clara hall expert energi technolog explain frack allow we extract natur ga deep ground enough inform avail chemic frack local peopl afraid chemic poison pollut nearbi river even wor place damag do ground frack alreadi caus earthquak alway danger major explo deal ga oil controversi sourc energi canada oil come oil sand alberta oil sand mixtur sand water heavi oil cover huge area provinc past expen oil mixtur last year price oil increa much becom financi worth addit polit advantag canada sourc oil becom independ countri lot peopl worri pollut extract oil caus end yet jeff tanner protest lead campaign oil compani co emiss oil sand high project disturb anim normal live oil compani also destroy huge area million wild anim rare bird live also anoth problem transport sinc decis build new pipelin alberta pacif coast protest stop support project claim creat thousand new job oil industri reduc fuel price new pipelin abl transport lot oil present jeff tanner howev think new job temporari oil export price oil canada chang worri us leak pipelin add cross mile farmland mani river leak great damag peopl wildlif mani expert agre view cour problem oil ga renew mean simpli soon later replac complet power move water one way time write canada energi come water power water power plant across countri big project jame bay project quebec howev project often also affect chang larg region addit increas amount energi produc wind last year new project geotherm energi take heat deep earth heat water hot water drive power plant produc electr activist jeff tanner expert clara hall think need concentr renew energi sourc even canada readi futur even well,,374
