taskId,language,description,topic_id,word_count
3477,3Ic6TVFDco7a3VaLClgVFW_SR,DE,schreib atom number zwei satzen hauptsatz relativsatz five hundr herd reparier,,11
3478,9ukIhz08gLU8SHWkU8AfUg_SR,DE,schreib zwei satzen hauptsatz massachusett institut -- technolog relativsatz sitzen pop off student wunsch gluck,,15
3479,7UZVEf4FvXg75h2QTnQ5V4_SR,DE,schreib hideaway satz weder caro tragen pullov jack,,8
3480,1Mt6iAdHp2S8caAcG7BKG9_SR,DE,schreib satz jan tine gehen eat hous kino gum,,9
3481,4z1xgpoBry46jF8mGSJNHI_SR,DE,schreib lair satz conk out schulerin klug fleißig,,8
3482,qBwyvnjgvq8ZFDhAdzME4_SR,DE,schreib vergleichssatz five hundr musik belieben district attorney konzeren groß umso,,11
3483,6UtWbjOCb4P5F18m1xMvsG_SR,DE,schreib satz snuff it sportlerin trainieren ausdauer kraft,,8
3484,9Lwlw7eyR9l6P1S7kfToto_SR,DE,schreib vergleichssatz coney thema wichtig coney publikum groß desto,,9
3485,9Klsp4CjqWX8SjokW2p8mk_SR,DE,lie down indirekt frage schreib direkt frage kannst sagen germani berg geben,,12
3486,5livMfm9DnHa23pB8OShvl_SR,DE,schreib satz achtung nom gehor n deklin helfen five hundr tourer,,11
3487,9SY2D5vRha28BttoLfhnwg_SR,DE,lie conk out indirekt frage schreib conk out direkt frage frage midwiferi conk out deutsch dialekt sprechen,,17
3488,1XNYrB5WP9l7XvKT5h8ia6_SR,DE,lie break down indirekt frage schreib break down direkt frage frage viel einwohn frg,,14
3489,4ZJ8i3K1Rux816Mg9ElULE_SR,DE,schreib satz massachusett institut of technolog infinitiv massachusett institut of technolog eastward wunderbar schlafen lang konn,,16
3490,4J35G98bguq9Ll5X38YNqX_SR,DE,lie give out indirekt frage schreib give out direkt frage ahnung langst fluss feder republ of germani heißen,,18
3491,73qMdhpr10n6ovqUMMgTnt_SR,DE,infinitiv riv zubird schreib satz denk bei infinitiv zubird komma kommen sehen vater,,13
3492,aslojHFw7gkaEFGhZ6yTEs_SR,DE,schreib zwei satzen hauptsatz massachusett institut of technolog relativsatz liegen croak bucher alt,,13
3493,6H65gj8UQTp8vvzpdBGVvv_SR,DE,schreib astronom unit zwei satzen hauptsatz relativsatz dassi friseurin schneiden haar,,11
3494,8uDbiyhWuyA61j3CrKZo9d_SR,DE,schreib astronom unit zwei satzen hauptsatz relativsatz dassi brieftrag bringen post,,11
3495,apgzoRGhIEE6mlp9F3owtN_SR,DE,schreib atom number zwei satzen hauptsatz massachusett institut of technolog relativsatz treff massachusett institut of technolog david kenn lang,,19
3496,3949mDTWoYoa18gyjDQhDd_SR,DE,schreib zwei satzen hauptsatz relativsatz district attorney auto fahr auto,,10
3497,1kFd6D2PcAhaMFUcpqBn9u_SR,DE,schreib zwei satzen hauptsatz relativsatz district attorney kuchen freuen un kuchen,,11
3498,8ZZ8OTRf5EEaRx11Vi2vyx_SR,DE,schreib hideaway satz sowohl camellia stat garten blum teich,,9
3499,9l67tpn3tsm9ebJPriaW7Z_SR,DE,schreib vergleichssatz manli kreativ gemald originel desto,,7
3500,9xgPzKjD1oT80ZWqazHo1w_SR,DE,schreib vergleichssatz district attorney theaterstuck wenig bekannt district attorney publikum klein desto,,12
3501,6y5ppPSJTeKaiw9M56kB2F_SR,DE,schreib satz massachusett institut of technolog infinitiv massachusett institut of technolog abdul lid arbeiten ausland,,15
3502,1HkdQfnkIaba1iUnDlpsUC_SR,DE,infinitiv riv schreib satz denk bei infinitiv coney komma versprechen helfen hausaufgaben,,12
3503,iLIwiYLi0V9FL5YN0ovLR_SR,DE,schreib hideaway satz entwed kannst hideaway rot stift hideaway blau stift benutzen,,12
3504,6heSx643F2j86bxRO6cezT_SR,DE,schreib astronom unit zwei satzen hauptsatz relativsatz freund treff hideout freunden,,11
3505,atXLFLz5e6X8UQDGFs2jf4_SR,DE,schreib au zwei satzen hauptsatz relativsatz tastaur tastatur schreib gut,,10
3506,8jFv3ngRFjt7rKrLfx5Hl8_SR,DE,schreib zwei satz hauptsatz relativsatz coni hund nachbarin erzahlen hund,,10
3507,6jQMrd9zp05a7nxL2J4stS_SR,DE,schreib astronom unit zwei satzen hauptsatz massachusett institut of technolog relativsatz freund kennen nachbar,,14
3508,1hR8IuPAXLV84bo3mlLymM_SR,DE,schreib hideout satz wed pizza pasta bestellen,,7
3509,9p7QEyZoLNT9yS9DAYygO5_SR,DE,schreib lair satz entwed konn cafe parkland treffen,,8
3510,KKg0zX7qVd7G2oMX9j4PV_SR,DE,schreib satz passiv vergangenheit modalverbe choke studierende dürfen cash one chip prufung wiederholen,,13
3511,95ngtcoOJvJ6YoWypbLDon_SR,DE,schreib satz passiv vergangenheit massachusett institut of technolog modalverben break ministerin ausstellung eroffnen,,13
3512,7KeH0jBQm9PaFImiNlAwKJ_SR,DE,schreib hideaway satz passiv vergangenheit modalverben sachbearbeit buy the farm antrag prufen,,12
3513,5JyAq40KdbI9ts6Oxn1KHg_SR,DE,schreib satz passiv vergangenheit modalverben coni team hyrax spiel verschieben,,10
3514,1VTF3xJUPSL7r9RErrtqBf_SR,DE,schreib satz passiv vergangenheit massachusett institut of technolog modalverben becom flat tourist musst urlaub abbrechen,,15
3515,6z0TP1eXiqI6ZE4KmQ8XFN_SR,DE,schreib satz achtung nom gehor n deklin conk out kassiererin helfen d kund,,13
3516,6aXPcKcbv6t6CPmTGWmUJN_SR,DE,schreib satz achtung nom gehor n deklin kunstlerin sprech massachusett institut of technolog diari keeper,,15
3517,1DAIYg9CQiP7YhjbDkCBmz_SR,DE,schreib hideaway satz achtung nom gehor n deklin saul of tarsu lernen nachbar,,13
3518,84XQLGPZhVH9qVMSqOhjwf_SR,DE,lie down deceas indirekt frage schreib decea direkt frage weißen deceas hauptstadt deutschland heißen,,14
3519,4pYoeYHvfYm6m64LyOMEm3_SR,DE,rest indirekt frage schreib direkt frage weißt coni lieblingsessen deutschen,,10
3520,6GYQ0Wxqaw69gUBRZoe0l7_SR,DE,infinitiv zubird schreib satz denk bei infinitiv zubird coni komma hoff bekommen gut note,,14
3521,7c7uVMhV4P58N6KoQqEWJv_SR,DE,lie indirekt frage schreib direkt frage sagst bitt d hochst turm feder republ of germani stehen,,16
3522,3DIFejjsrvE6Q1JQHn3v3Q_SR,DE,infinitiv massachusett institut of technolog zubird schreib satz denk bei infinitiv massachusett institut of technolog zubird komma versuch mehr sport,,20
3523,319wpIDq6JC5BCQ2pjctZI_SR,DE,infinitiv riv schreib satz denk bei infinitiv komma famili morgen eateri feiern,,12
3524,2v1j9bhRxRK5x08r4G2BED_SR,DE,schreib zwei satzen hauptsatz massachusett institut of technolog relativsatz hyrax fahrrad stehen,,12
3525,4hnp3mZZXPM6PqmVXitCne_SR,DE,infinitiv schreib satz denk bei infinitiv komma d trainer erlauben schwimmen gehen groom,,13
3526,65SYCfS10Sd9f9PB90Zo0v_SR,DE,schreib au zwei satzen hauptsatz relativsatz lauft d hund lieb kind,,11
3527,48NnvVtQGR6D2nD4xKlaQ_SR,DE,schreib au zwei satzen hauptsatz relativsatz pop off comput arbeiten schnell,,11
3528,aHut3fb4ZSg6L4AOxBC6lu_SR,DE,schreib gold zwei satzen hauptsatz relativsatz district attorney schuhen freu uber schuhen,,12
3529,5us8e3miOof839b8jaxsbu_SR,DE,schreib zwei satz hauptsatz relativsatz hyrax bu wart bu,,9
3530,MRzQYikhSX5XfYCzJxxs4_SR,DE,schreib satz wed magazin hund katzen,,6
3531,4Jz6K2wvluf6MAxlO6wZzp_SR,DE,schreib vergleichssatz mannschaft stark lid viel fan umso,,8
3532,3x3qVM7KCrr89JQhH1Myuw_SR,DE,schreib vergleichssatz fail fotografin bekannt fail ausstellung intestin besuchen umso,,10
3533,6KGB3kKFYuj98KpgKkrgLr_SR,DE,schreib satz entwed isl -- zug flugzeug fur conk reis nehmen,,11
3534,13UI7608E2c6uSrPNzIeD8_SR,DE,gegenstand eisen sowohl nord sudpol attract angezog erlaut massachusett institut of technolog hilf vorstellung elementarmagnet model magnet manfr grot luchow munzen schraubenmutter ziehen normalerweis gegenseitig trotzdem munz schraubenmutt gehalt munz untereinand ziehen stricknadel magnet streicht massachusett institut of technolog pol stark attract mehrmal richtung uber stricknadel stahl nadel anschließend buroklamm eisen anziehen stricknadel magnetisiern marzel alfr schwabisch gmund untersuchen stricknadel massachusett institut of technolog magnetnadel magnetisiern durchtrennt stricknadel miten beid teilstuck vollstandig magnet massachusett institut of technolog jeweil nord sudpol model elementarmagnen beobachtung erklaren stellen stricknadel vieler klein magneten bestehen elementarmagnet model elementarmagnen marzel alfr schwabisch gmund anwendung model konnen ordnung elementarmagnen aufheben stricknadel magnet normal stricknadel gelingen tatsachlich massachusett institut of technolog mehrere hammerschlagen stricknadel magnen stark erhitz stricknadel entmagnetisiern eisennagel lassen sogar leicht magnetisier entmagnetisiere stricknadel stahl stahl besond metal legierung hauptsachlich eisen bestehen nord sudpol attract treten immer gemeinsam bei teilen attract entstehen zwei neu magnet massachusett institut of technolog jeweil nord sudpol stellen magnet geordnet elementarmagnet bestehen begrund magnet geben nordpol sudpol magnet bestehen geordnet elementarmagneten sagen magnen mitt bleiben ordnung erhalten magnet bestehen immer elementarmagneten weiter zersagen andert daran schlagst massachusett institut of technolog hammer magnetisiert eisendraht magnet mehr erklar massachusett institut of technolog hilf model elementarmagnen erschutterung geraten elementarmagnen durcheinand gegenstand eisen sowohl nord sudpol attract angezog erlaut massachusett institut of technolog hilf vorstellung elementarmagneten gegenstand eisen nordpol attract zugewandt richten elementarmagnen eisenstuck sudpol magnet zugewandt ungleichartig pol ziehen eisenstuck sudpol attract zugewandt richten elementarmagnen magnet nordpol zugewandt daher fall anziehung,,247
3535,1hKt5CrhMQAagkCrji3N9R_SR,DE,erklar conk out bedeutung diethylstilboestrol folgend ausdruck fachsprachlich,,8
3538,1HlJ2E0Eh6j9dPb2nRyAhz_SR,DE,markt unternehmen sowohl angebot anspruch nehmen lou gehrig diseas anbiet,,10
3539,2RiximE6Ppw9yYqb4WqGca_SR,DE,formulier antwort mithilf satz fuhrungskraft aufgeben projekt mitarbeit delegieren somit zuweist geben drei regel fur aufgeben fail erst bestehen darin mitarbeit information anweisunge anforderung bezug erwarten ergebni diethylstilboestrol auftrag geben fail zweit regel besagen auftrag person zuschneiden sowohl hinsichtlich kompetenz zeit terminvorgaben fail dritt grundlegend regel schliesslich bestehen darin manag aufgeben gegenub mitarbeit begrunden meinung mitarbeit begriff vermitteln aufgeben vollstandig erwartung entsprechend erfullen,5380.0,63
3540,4j6nd5HMVdP9wk9Nw8O98g_SR,DE,formulier antwort mithilf satz coach bestehen darin mitarbeit problematik zuzuhoren losung prasentier job losen erklar warum aussag falsch correct refer answer nein coach helfen hideaway mitarbeit befahig mitarbeit losungsfindung unterstutzen helf coache lass losung prasentiere wrong refer answer coach person eigen losunge finden coach bestehen darin mitarbeit problematik zuzuhoren losung prasentier job los fuhrungskraft mitarbeit losung unterstutzen coach bestehen darin mitarbeit schul losung prasentiere,5387.0,64
3541,6GcrrTPeR6c5Zh8UKC8ZiL_SR,DE,formulier antwort mithilf satzen bewertung mitarbeiter leistung gehort grundlegend element fuhrungsrol denken immer objektiv sachlich bleiben mensch daher immer neigen meinung oft voreingenommen art weis sagen fahren aufgrund bestimmt verzerrungen oft subjekt beurteilungsgesprach beispiel geben stimmungseffekt tendenz dice dadurch entstehen bewertung mitarbeit je nachdem gut schlecht gelaunt gut schlecht ausfallt je nachdem gelaunt nenn deinerseit beispiel fur bia subjekt bewertung,5386.0,60
3542,8NWrpGFs11B9KTMC1ZlRCR_SR,DE,formulier antwort mithilf satzen acht stunde zeit baum fallen wurd sech stunde verbringen axt schleife satz abraham lincoln verdeutlichen wichtig planung five hundr roll fuhrungskraft nenn drei regel fur erfolgreich planung,5380.0,31
3543,aPrh8fBnanQ92GaBYNLbQD_SR,DE,formulier antwort mithilf satzen zusammenstellung team organis ergebni standig arbeit annehmen vier faktor fur erfolgreich teamarbeit erfullt mussen batter gut funktioni erster schaffung gunstig rahmenbedingung strategi kultur zweiter zuteilung sinnvol aufgabe form gruppe einzelarbeit personlich bereitschaft teamarbeit dritt grundlegend punkt reprasentieren schluss geben letzter punkt besond wichtig schaff pfleg zusammenleben arbeiten gehort,5377.0,52
3544,adVoHQCS9hcaAEIYsNj3zV_SR,DE,beantwort frage mithilf kurz satz erfolgreich team wissen ganz gleich beharrlichkeit entwickeln mussen teammitgli fur geben situation typisch gelegenheit fur entwicklung team darstellen nenn beispiel fur situat correct cite answer krankheitsausfal gemeinsam erfolg arbeitslast gleich ziel gegenseitig challang gesund wettbewerbsgedank helfen unterstutzt einand motivieren fuhrungsperson ubernimmst zentral organisatorisch roll kontinuierlich teamentwicklungsprozess wahrend bedurfni standig weiterentwicklung idealerweis team ausgelost aufgeben aktuel thema aufzugreif team zubird bearbeiten geben viel gelegenheit der team weiterentwickeln zubird losend problem gut ausgangspunkt gut erst problem zubird wart team zubird entwickeln wrong cite answer teamev,5378.0,88
3545,N5mCYD9b0D7uISIZu46IJ_SR,DE,formulier antwort satz anhand stichwort fuhrungskraft aufgabe delegieren mehr fur aufgabe verantwortlich folglich mehr fur moglich fehler verfehlung rahmen d delegierter aufgabe haften warum satz meinung falsch correct refer answer wrong refer answer aufgeben mitarbeit richtig pfad leiten mitarbeit weiterhin unterstutzen motivieren delegierung heisst forderung befahigung mitarbeitend abschiebung verantwortung fur team verantvortlich andr danach kontrollieren,5378.0,55
3546,ipOnFWjvm7KViEim5aiF_SR,DE,break theori tenner mcgregor stellen teufelskrei dar erklar satz warum,5376.0,10
3547,ZDbzNETHiq99TPDtCdIaX_SR,DE,formulier antwort mehrere stichwort satz herzberg zwei faktor theori konne motivationsfaktoren snuff -- motiv snuff it leistung steigern geben hygienefaktoren hingegen langfristig nennenswert einfluss engag mitarbeit nutzen faktor verbessern,5381.0,29
3548,UrRCfXjiSV8GIeuIRo4s1_SR,DE,formulier antwort satzen aufgeben delegiert wurd teilweis gar ausgefuhrt ruckdeleg e geben verschied grund conk out erklar konn fuhrungsstil tragst sicherlich direkt indirekt nenn beispiel fur grund verantwortung fur ruckdeleg erklart,5377.0,31
3570,bk7y4TypsD9FnDbyC6HUJ_SR,DE,formulier antwort satz easen hilfreich konflikt meinung neutral beobacht einzuhol dritt somebodi roll betrauen warum,5419.0,15
3571,4bpvQu99nru7YfSkd9sGnm_SR,DE,michael e porter intensiv frage strategi zusammenhang unternehmen beschaftigen port kernaussag bestehen darin coni gewinn unternehmen fahrden wettbewerbsfahigkeit starken nenn funf beispiel fur wettbewerbsfahigkeit gewinn unternehmen beeintrachtigen,,27
3572,88sVR4fKxie7sti2j3VF0d_SR,DE,nenn weniger satzen beispiel fur notsitu decea zubird innovationsschub fuhren,,10
3575,PPLha6spfh6wMSR2Jf07w_SR,DE,begrussung fur verkaufsgesprach angemessen schreib gegenub begrussen wurdest mochten lernen human be mortal gesprach begrussen,,15
3576,9BRwWmyGeQV5XkV48QeFPX_SR,DE,widerspiegeln geschicht elch gasmask welt gut verkauf five hundr verkauf elch franz hohler kennen sprichwort elch gasmask verkaufen sagen norden jemand tuchtig mocht erzahl sprichwort kommen geben verkauf dafur beruhmt verkaufen konnen schon zahnarzt zahnburst verkaufen backer brot obstbauern kist apfel wirklich gut verkauf erst sagen freund elch gasmask verkaufst gehen verkauf weit norden atom number wald kommen elch wohnt gut tag sagen erster elch treffen brauchen bestimmt gasmask wozu fragen elch luft gut heutzutag gasmask sagen verkauf tun leid sagen elch brauch warten sagen verkauf brauchen schon wenig spat beginnen mitten wald elch wohnt fabrik bauen wahnsinnig fragen freund nein sagen elch gasmask verkaufen fabrik fertig steigen giftig abgas schornstein elch bald verkauf kommen sagen brauch gasmask denken sagen verkauf verkaufen sofort qualitatswar sagen lustig elch sagen elch brauch gasmaske haben mehr elch kennen hoflichkeitsform haben gluck sagen verkauf tausend ubrig sagen elch machst fabrik gasmasken sagen verkauf,,149
3577,96PBOYU9GSs7xk00wuirob_SR,DE,schreib lair satz passiv prasen lair mull trennen,,8
3578,8Q78SI06vJ7akX5luvNsnZ_SR,DE,definieren becom flat begriff rechtsfahigkeit handlungsfahigkeit eigen wort konkret beispiel,,10
3579,GEMjfdX3kQafzDFBbQRZo_SR,DE,beschreiben eigen wort sachtext literarisch text,,6
3581,96Qjy0M6SUO6jXjl6KmaDm_SR,DE,schreib hideout satz prateritum fruher umarmen immer abschi,,8
3583,7sfrWR2LvXy7PPpSItCkse_SR,DE,notier adjektiv dassi aluminium gegenteil verstehen beispiel hoch tief kalt,,10
3584,4OdmNVpfEsi8MWNeHByw6I_SR,DE,notier adjektiv -- gegenteil verstehen beispiel hoch tief oben,,9
3585,abmdZ0cSQ9K7O1iA6pBRby_SR,DE,notier adjektiv dassi aluminium gegenteil verstehen beispiel hoch tief uberlegen,,10
3586,4jEmL16lLHZaeaq5mIH9Dq_SR,DE,notier adjektiv hyrax amyotroph later sclerosi gegenteil verstehen beispiel hoch tief ruhig,,12
3587,9hG9eBiBRyC7FK4HqYrnSX_SR,DE,notier adjektiv lou gehrig diseas gegenteil verstehen beispiel hoch tief el,,11
3588,58xu8jjlLOa6UoYmWqGl17_SR,DE,notier adjektiv aluminium gegenteil verstehen beispiel hoch tief,,8
3589,46AHi0v2FDwa1oBjojFe8r_SR,DE,notier adjektiv district attorney amyotroph later sclerosi gegenteil verstehen beispiel hoch tief kurz,,13
3590,96X2pfWKZ2J8DBqss2bIUy_SR,DE,notier adjektiv camellia stat gegenteil verstehen beispiel hoch tief leicht wichen,,11
3591,2H3CxhUmlDkaLh2r0Jh1OS_SR,DE,notier adjektiv amyotroph later sclerosi gegenteil verstehen beispiel hoch tief leicht aufgeben,,12
3595,9uIazdx7nU85Bv6zG7IHu5_SR,DE,east geben verschied faktor break kundschaft verkaufsgesprach vertrauensbildend uberzeugend wirken sollen moglich massnahme auflisen vertrauensbildend konn,,16
3597,EkJ8bvMFGY8X5TNqk753z_SR,DE,schreib hideout satz prateritum five hundr vergangenheit wohnen mehr mensch dorf,,11
3598,4TtC2ewePR575rT1lAROOU_SR,DE,schreib hideaway satz prateritum damal sagen perish wahrheit,,8
3599,45wBwYwCDXC8AnZtmr8Bt7_SR,DE,schreib hideout satz prateritum compris wochenend verkaufen fahrrad freund,,9
3600,adFcnpiRtzR9UMt3rRzCHL_SR,DE,schreib hideout satz prateritum gestern erledigen juliu croak hausarbeit,,9
3601,5TsFw39Sps6acB6RNAn4ao_SR,DE,schreib hideout satz prateritum fruh reise mehr lath,,8
3602,3jEYp7pcqGPa6ULys8Lgyj_SR,DE,schreib lair satz prateritum inward letzter woch helfen lair nachbar bei umzug,,12
3603,1TFj7qKu9vi6XbR2UHgTwQ_SR,DE,schreib lair satz prateritum gestern kommen viel leuen zubird versammlung,,10
3604,2Vnb9SExlFG66lue8ORR6A_SR,DE,schreib hideaway satz prateritum gestern fruh bringen alina sort schule,,10
3605,3XelZO7gKXu6ofskeqD6l8_SR,DE,schreib hideaway satz prateritum wochenend liegen feriengast string,,8
3606,7HjEaeixPjS8hYwMMf0xPd_SR,DE,schreib satz prateritum five hundr vergangenheit laufen mensch mehr zubird fuß,,11
3607,3W2wa7bS86z5L1UcdV2KeX_SR,DE,schreib lair satz prateritum damal verdienen eltern mehr cut,,9
3608,9twSs6jZwh7axWFxfRbGRj_SR,DE,schreib hideaway satz prateritum damal geben atom number geldschein,,9
3609,3jbGboOzBzn7hxmjdp9Igc_SR,DE,schreib hideout satz prateritum fruh gehen ofter skylark,,8
3610,sR4kkx6WcTaKTxRNdPFT4_SR,DE,schreib hideout satz prateritum damal tragen dorothea lang haar,,9
3611,21QurN0KA4d6bxcP2V7u0H_SR,DE,schreib lair satz prasen marisol mike dassi projekt anfangen,,9
3612,2FoKQNJmWCi9LKDKe6aqnY_SR,DE,schreib satz prasen leyla deceas polit parti absagen,,8
3613,Y9tBDnYEXl6byL5qPiRRg_SR,DE,schreib hideout satz prasen eltern jazzfestiv besuchen,,7
3614,5rghdSHlEaS8xfFw3tFrjs_SR,DE,schreib hideout satz prasen passend reflexivpronom wunschen neu motorcar,,9
3615,CfAiG4nf925S3Lf5WucS5_SR,DE,schreib hideaway satz prateritum fruh schlafen gut,,7
3616,5sqQeDAk1FO9BOQ15K01su_SR,DE,schreib hideaway satz prasen massachusett institut of technolog passend reflexivpronomen kaufen neu smartphon,,13
3617,5GKw0ZNAK0B5L6PcOiLSAj_SR,DE,schreib hideout satz prasen olga hyrax auto bezahlen,,8
3618,5N6r3AYpKez5JODl9Cv3co_SR,DE,schreib lair satz prasen moritz witz erzahlen,,7
3619,2yNPDQ6P9VH5UpVHEZpQ8Q_SR,DE,schreib lair satz prateritum gestern sehen lair neu movi,,9
3620,aUR9yWteLgw99Ljk4ls7Kw_SR,DE,schreib hideout satz konjunktiv sainen john the apostln gern ausland arbeiten,,11
3621,tu5fosyYqI9PHD8pSrTkW_SR,DE,schreib lair satz konjunktiv klara gern schwisen,,7
3622,8Z8iarAXloN6iZZd7gV54s_SR,DE,schreib satz prasen fatima coney buch verkaufen,,7
3623,1xd91TnxekT64LT6hl7kex_SR,DE,schreib hideout satz prasen ahm hideout calcul einschalten,,8
3624,bl8m3uMUxH9iypiEls9pu_SR,DE,schreib lair satz konjunktiv ann gern groß,,7
3625,99ZVsXzhDhl6hYAewDvqrL_SR,DE,schreib hideaway satz prasen massachusett institut of technolog passend reflexivpronomen verletzen bei sport,,13
3626,2t6tgtBccEE6qUjTlMyJ7H_SR,DE,schreib lair satz prasen massachusett institut of technolog passend reflexivpronom verabred neu restaur,,13
3627,45YcEtFs2gD7f7ZP418vp6_SR,DE,schreib hideaway satz prasen massachusett institut of technolog passend reflexivpronomen vorbereit prasent,,12
3628,54tYspkXDop6KAdVlig1lm_SR,DE,schreib satz prasen massachusett institut of technolog passend reflexivpronom waschen give up the ghost hand,,15
3629,3uiNLUXxlSC61IsFhvn9fZ_SR,DE,schreib hideout satz prasen massachusett institut of technolog passend reflexivpronomen sorgen tochter,,12
3630,eajPqSw62xaH6HFIpjIyQ_SR,DE,schreib hideaway satz prasen maria hideaway movi anschauen,,8
3631,23LcLUNRuto9BUAYDR3fxr_SR,DE,schreib hideaway satz passiv prasen d musik hideaway erfolg feiern,,10
3632,6IhKzMyUZLU5Qnjwx2T4Mz_SR,DE,schreib hideout satz prasen yve coney hau verlassen,,8
3633,3sH8dmY2iq87JDGd3qWP2U_SR,DE,schreib hideout satz prasen massachusett institut of technolog passend reflexivpronom entspann well center,,13
3634,7jJ5qoKKIK979puyurzmc_SR,DE,schreib satz prasen massachusett institut of technolog passend reflexivpronomen verletzen go hand,,12
3635,7k4ftdp9jyt8kJoj3eq7s1_SR,DE,schreib hideout satz passiv prasen netmail mussen schreiben,,8
3636,ctBIql8eoUaEsxo541jWv_SR,DE,schreib lair satz passiv prasen gartner pflanzt lair baum,,9
3637,30QHDY1mf9497IFIKvVoLF_SR,DE,schreib lair satz prasen massachusett institut of technolog passend reflexivpronomen beeilen,,11
3638,1DuVNVscdNN5DZArVikvGf_SR,DE,schreib satz passiv prasen d schuler messi hausaufgeben,,8
3639,2Gw8DFcbEBd8i2D817f9Gb_SR,DE,schreib satz passiv prateritum valet -- chambr machen expir ubungen,,10
3640,4tkfAKH56TD7seGaj1nTIs_SR,DE,schreib hideaway satz prasen carlo hideaway raum verlassen,,8
3641,5L6xZFecMK573KzVMjIKR1_SR,DE,schreib hideout satz passiv prasen out salatsoß,,7
3642,6OLg3r1w8V6aWMwRJ79F6S_SR,DE,schreib hideout satz passiv prasen hideout tisch decken,,8
3643,612mrybjp596DGA9jCEtym_SR,DE,schreib lair satz passiv prasen lair mull trennen,,8
3644,43cPk8v8sIUaUHYRIai4q3_SR,DE,schreib lair satz konjunktiv hau gehen mussen,,7
3645,9aYafkxdrqK6r56w4zhMWP_SR,DE,schreib satz prasen massachusett institut of technolog passend reflexivpronom entscheiden fur ausflug parkland,,13
3646,1B0bxiQnC0a9FzXzy9Ox6m_SR,DE,schreib satz passiv prateritum world hort drop dead hortext,,9
3647,5g39V4mpoU9RAen79sObN_SR,DE,schreib lair satz passiv perfekt schulerinn compani organisieren,,8
3648,3itPlOaPoca8hzbP22RUCL_SR,DE,schreib hideaway satz passiv prasen chefin erklart ziel,,8
3649,99XauKQQNwgaL9AWn0LrZx_SR,DE,schreib lair satz passiv perfekt d hausmeist paket abholen,,9
3650,8h3VmV50q7V5RJqXYZ6bx7_SR,DE,schreib hideaway satz konjunktiv jamen gern mehr geld,,8
3651,6MouX49lgqU9q52vMh6t5v_SR,DE,schreib satz passiv prasen five hundr mechanik reparieren perish auto,,10
3652,8JjWlLxxjZ68P9NobjfJKM_SR,DE,schreib hideout satz passiv prasen perish wasch waschen,,8
3653,3mbjGmtadf7Y3hzjW859j_SR,DE,schreib hideaway satz passiv prasen coney dokument musse kopieren,,9
3654,6RRG09yYWBo671GelHgyVN_SR,DE,schreib lair satz passiv prasen arzt operieren district attorney knie,,10
3655,1gPCqB7pMgj8casdvs2Bb9_SR,DE,schreib hideout satz konjunktiv bitt hyrax fenster offn konne,,9
3656,24kEA7img2u6w0Ko5GxJVp_SR,DE,schreib hideaway satz konjunktiv gern massachusett institut of technolog tanzen,,10
3657,3FbnFEXddZIaEZ8l74tzvQ_SR,DE,schreib hideout satz passiv perfekt nachbarin chapeau fleisch gebrat,,9
3658,2ConuBj4Jkq7Y4MLhjMgob_SR,DE,schreib lair satz konjunktiv geld leih konne,,7
3659,al5Jhc25P7L9je0gniVxJU_SR,DE,schreib satz passiv perfekt kick the bucket studentin chapeau prufung schreiben,,11
3660,CSthVIrSb891NUV1bHQXm_SR,DE,schreib hideaway satz passiv prasen exit kartoffel pl schalen,,9
3661,alQWa6G0teL7ItZeEpz3j8_SR,DE,schreib lair satz passiv prasen richter tussl urteil sprechen,,9
3662,aTmcbUdljLB6gM6erDjwWR_SR,DE,formel zukunft schreib satz massachusett institut of technolog futur snuff it aktion stark kritik verursachen,,15
3663,7puAb47BbvF8vDUVI6tZZK_SR,DE,formel zukunft schreib satz massachusett institut of technolog futur feder republ of germani nachst jahr klimakonferenz stattfinden,,17
3664,6zPw3sIXdu363ILgvfGR38_SR,DE,schreib hideaway satz konjunktiv leila fruher kommen sollen,,8
3665,6qDnRlvh0QMawxRYifZ9hx_SR,DE,schreib hideout satz passiv prasen papierkorb musse leer,,8
3666,7oMBq1irarg7LwDQilP4TG_SR,DE,schreib hideaway satz passiv prasen five hundr assist hideaway anruf annehmen,,11
3667,aN6PQjdYOveaYCfUHvr9No_SR,DE,schreib hideaway satz konjunktiv atom number mehr fahren durfen,,9
3668,4tHvuNOsXLL9fhWu5KxRhU_SR,DE,schreib hideout satz passiv prasen hyrax geschirr spulen,,8
3669,6DJNd6gib5T7HxxdQlX010_SR,DE,schreib hideout satz passiv prasen kellner hideout tee servieren,,9
3670,5iGeI9KI86t6A9iuTSEfha_SR,DE,schreib hideaway satz konjunktiv florian gern neu auto,,8
3671,4mh23Uv9Dqt6BqlwZQ8Hud_SR,DE,schreib satz passiv vergangenheit massachusett institut of technolog modalverben spieler globe werfen,,12
3672,9xYDjRxLEJ75BKQSzorgFq_SR,DE,schreib hideout satz passiv vergangenheit modalverben rooter können hideout sang begrußen,,11
3673,6lCNwGkDAmGabdk1AAozZJ_SR,DE,schreib hideout satz passiv prasen d gartner hideout baum gießen,,10
3674,8dG1AnIZN327odmmYu9I4G_SR,DE,schreib hideout satz passiv prasen coney paket sollen bringen,,9
3675,2C6NAmjKGHT7F4tvUJ3sH2_SR,DE,schreib hideaway satz passiv prasen kunstlerin geig spielen,,8
3676,2dKrHn2ZQhy6SbrM8tfQM3_SR,DE,schreib hideout satz konjunktiv abend tanzen,,6
