language,description,context,tenant_id,tenant_name,topic_name,topic_description,word_count,taskId,preprocess_desc,preprocess_context
16885,deu,"Bitte geben Sie Ihre Antwort mithilfe eines oder mehrerer Schlüsselwörter an.In einem Kritikgespräch, in dem es beispielsweise um ein Fehlverhalten oder eine ungenügende Leistung geht, muss ich als Führungskraft eine Kritik an meinem Mitarbeiter formulieren. Diese Kritik sollte, um möglichst konstruktiv zu sein, auf etwas sehr Wichtiges gerichtet sein, das durch Emotionen oft verzerrt wird und in die Subjektivität abdriftet.Worum geht es?",,11.0,connectsolutions_de,5. Verhalten sich in unterschiedlichen Gesprächssituationen klärend und angemessen,,62,2FRbuv73DKKakf72y9H90L,Bitt geben Antwort Mithilf Mehrer Schlusselwort kritikgesprach Beispielsweis fehlverhalten ungenugend Leistung gehen Fuhrungskraft Kritik Mitarbeit formulieren Kritik moglichst konstruktiv wichtig richten Emotion oft verzerren Subjektivitat abdriften Worum gehen,
16888,deu,"Walter (28) ist Buchhalter Debitoren bei der Generaldirektion SBB in Bern. Nennen Sie einige Aufgaben sowie mögliche Kompetenzen und Verantwortung seiner Stelle.-----Taskbase Kommentar: Bei der folgenden Aufgabe handelt es sich um eine offene Aufgabe. Für die Aufgabe war keine Musterlösung hinterlegt. Taskbase hat die Aufgabe im besten Wissen, mit den vorhandenen Informationen aufgesetzt. Da keine Musterlösung vorhanden war ist es möglich, dass manche Antworten gemäss der Einschätzung von hep fehlen. Bei einer Zusammenarbeit würden diese didaktischen Diskussionen passieren. Der Feedbacktext soll dem Lernenden einen Hinweis geben, was eine korrekte Antwort sein könnte. Der Feedbacktext enthält keine Musterlösung.",,75.0,iterativ-sandbox,,,97,WQpEgyLgi089ljEf8PuJw,Walter Buchhalt debitoren Generaldirekt Sbb Bern nennen Aufgabe sowi moglich kompetenz Verantwortung stell Taskbas Kommentar folgend aufgeben handeln offen aufgeben fur aufgab Musterlosung hinterlegen Taskbas aufgeben gut wissen vorhanden Information aufsetzen Musterlosung vorhanden moglich Antwort gemass Einschatzung hep fehl Zusammenarbeit werden didaktisch Diskussion passieren Feedbacktext lernend Hinwei geben korrekt Antwort Konnt Feedbacktext Enthalt Musterlosung,
16889,deu,"Wie nennt man diese Variante der Organisation?-----Taskbase Kommentar:Bei dieser Aufgabe handelt es sich um eine Cloze Aufgabe, die mit einem Wort beantwortet werden kann. Für die Aufgabe war eine Musterlösung vorhanden, anhand welcher die Aufgabe aufgesetzt wurde. Das Feedback gibt dem Lernenden einen Hinweis auf die richtige Lösung, enthält die Musterlösung aber nicht.",,75.0,iterativ-sandbox,,,53,aqFM7iL1gxE8Nl9d5EwMZ7,nennen variant Organis Taskbas Kommentar aufgeben handeln Cloze aufgeben Wort beantworten fur aufgab Musterlosung vorhanden anhand Aufgab aufgesetzt Wurd Feedback geben lernend hinwei richtig Losung Enthalt Musterlosung,
16890,deu,"Warum wurde wohl diese Organisation gewählt?-----Taskbase Kommentar:Bei dieser Aufgabe handelt es sich um eine offene Aufgabe. Für die Aufgabe war eine Musterlösung vorhanden, anhand welcher die Aufgabe aufgesetzt wurde. Das Feedback gibt dem Lernenden einen Hinweis auf die richtige Lösung, enthält die Musterlösung aber nicht. Als Feedback ist ebenfalls hinterlegt, wenn der Lernende Grammatik- oder Rechtschreibfehler macht. Dies liegt allerdings in der Hoheit von hep und kann individuell auf eure didaktischen Anforderungen angepasst werden.",,75.0,iterativ-sandbox,,,74,5CFVvAUF1ql5IyB56TENAa,warum Wurd wohl Organis wahlen Taskbas Kommentar aufgeben handeln offen aufgeben fur aufgab Musterlosung vorhanden anhand Aufgab aufgesetzt Wurd Feedback geben lernend hinwei richtig Losung Enthalt Musterlosung Feedback ebenfal hinterlegen lernend Grammatik Rechtschreibfehl machen liegen Allerd Hoheit Hep Individuel didaktisch Anforderung angepasst,
16891,deu,"Wie sind die Abteilungen organisiert?-----Taskbase Kommentar:Bei dieser Aufgabe handelt es sich um eine offene Aufgabe. Für die Aufgabe war eine Musterlösung vorhanden, anhand welcher die Aufgabe aufgesetzt wurde. Das Feedback gibt dem Lernenden einen Hinweis auf die richtige Lösung, enthält die Musterlösung aber nicht. Als Feedback ist ebenfalls hinterlegt, wenn der Lernende Grammatik- oder Rechtschreibfehler macht. Dies liegt allerdings in der Hoheit von hep und kann individuell auf eure didaktischen Anforderungen angepasst werden.",,75.0,iterativ-sandbox,,,73,3OSeZ6O83us8GUTd4pseaY,Abteilung organisieren Taskbas Kommentar aufgeben handeln offen aufgeben fur aufgab Musterlosung vorhanden anhand Aufgab aufgesetzt Wurd Feedback geben lernend hinwei richtig Losung Enthalt Musterlosung Feedback ebenfal hinterlegen lernend Grammatik Rechtschreibfehl machen liegen Allerd Hoheit Hep Individuel didaktisch Anforderung angepasst,
16904,deu,Beschreiben Sie anhand eines Beispiels aus Ihrer beruflichen Tätigkeit den Unterschied zwischen­ Eustress und Distress.,,11.0,connectsolutions_de,,,15,1wJ2BoVC0SE5WBXSwrrqfQ,beschreiben anhand Beispiel beruflich Tatigkeit unterschi eustress distress,
16905,deu,"Sie wollen Ihre Chefin von den Vorteilen einer «stillen Stunde» überzeugen. Nennen Sie mindestens zwei Argumente, die dafürsprechen.",,11.0,connectsolutions_de,,,18,7ouD1dvJsVi8EBD2bRnKu7,Chefin vorteil still Stund Uberzeug nennen mindester zwei Argument dafursprechen,
16906,deu,"Tina sagt: «Manchmal habe ich Mühe mit der Prioritätensetzung oder gerate in die typischen Zeitfallen. Dann bin ich unzufrieden mit meinen Arbeitsergebnissen, was sich auch auf meine Motivation schlägt. Umso mehr bin ich überzeugt, dass es sich lohnt, bei der Zeitplanung konkrete Ziele zu setzen. Sie motivieren nicht nur, sondern erleichtern auch die Zeitkontrolle, die wiederum einen positiven Effekt auf die persönliche Zeitplanung hat. Zudem stelle ich fest: Je motivierter ich bin, desto weniger Zeit brauche ich für das Erledigen von Aufgaben. Ich bin dann einfach effizienter!»Stellen Sie Tinas Aussage über die Zeitplanung in einem Problemnetz dar.Halten Sie alle relevanten Einflussfaktoren fest, die Wirkungsrichtung zwischen den Einflussfaktoren in Form von Pfeilen und die Wirkungsart durch «+» und «–».Ergänzen Sie Ihr Problemnetzwerk wo nötig mit weiteren bedeutenden Einflussfaktoren oder Wirkungen.",,11.0,connectsolutions_de,,,129,58KeFv8KBkG6biUL2vMAC7,Tina sagen manchmal muh Prioritatensetzung Gerat typisch Zeitfall Unzufrieden arbeitsergebnissen Motiv schlagen umso mehr uberzeugt lohnen Zeitplanung konkret Ziel setzen motivieren erleichtern zeitkontrol wiederum positiv Effekt personlich Zeitplanung zudem stell fest je motivieren desto wenig Zeit Brauch fur erledigen Aufgabe einfach effizient stellen Tina Aussag uber Zeitplanung Problemnetz dar halten relevanten Einflussfaktor fest Wirkungsrichtung einflussfaktor Form pfeil Wirkungsart erganz Problemnetzwerk notig weit bedeutend einflussfaktoren wirkungen,
16907,deu,"Ein bekanntes Sprichwort lautet: «Was ich nicht weiss, macht mich nicht heiss!»Beschreiben Sie anhand eines Beispiels, was dieses Sprichwort für den effizienten Umgang mit Informationen bedeuten könnte.",,11.0,connectsolutions_de,,,27,8fF4acPIaga8B8p612RCko,bekannt Sprichwort lauten Weiss Macht Heiss beschreiben anhand Beispiel Sprichwort fur effizient Umgang Information bedeuten Konnt,
16908,deu,"Drei Freunde unterhalten sich über den Stress bei der Arbeit. Welche Stressoren sprechen sie in ihren Schilderungen an?A. Jonas: «Manchmal habe ich das Gefühl, ich sei der Depp vom Dienst, wie man so schön sagt! Ich helfe meinen Teamkollegen ja wirklich gerne aus, aber in letzter Zeit landen immer mehr Pendenzen auf meinem Tisch. Ich bin selbst schuld, ich kann einfach weniger gut Nein sagen als andere!»B. Didier: «In meinem Job bist du ständig auf Achse, das gefällt mir. Aber mit zunehmendem Alter scheine ich die jeweiligen Zeitumstellungen immer schlechter wegzustecken, und deshalb empfinde ich die vielen Flüge nach Amerika und in den Fernen Osten mittlerweile wirklich als stressig.»C. Simon: «Die für unsere Branche angekündigte Entlassungswelle hat nun auch unser Unternehmen erfasst. Ich darf gar nicht daran denken, dass auch ich davon betroffen sein könnte, ausgerechnet jetzt, wo wir endlich unseren Traum vom eigenen Haus verwirklichen konnten! So gebe ich im Moment alles für meinen Job und leiste entsprechend viele Überstunden.»",,11.0,connectsolutions_de,,,161,9KWNJE2Ujke6rONsMRRyQL,drei Freund unterhalten uber Stress Arbeit stressoren sprechen Schilderung a Jona manchmal Gefuhl sein Depp Dienst schon sagen helf teamkollegen ja wirklich gern letzter Zeit landen immer mehr pendenzen Tisch Schuld einfach wenig gut nein sagen -- Didier Job standig Achs fallen zunehmend alt Schein jeweilig Zeitumstellung immer schlecht wegzustecken deshalb empfind vieler flug Amerika fern Osten Mittlerweil wirklich stressig c Simon fur Branch ankundigen Entlassungswel Unternehmen erfassen dürfen gar daran denken davon betroffen Konnt ausgerechnet endlich Traum eigen Hau verwirklichen können geben Moment fur Job leisen entsprechend viel uberstunden,
16909,deu,"Adrian nimmt eine Aktivitätenkontrolle vor. Nachfolgend finden Sie einen Ausschnitt davon. Beantworten Sie dazu die folgenden Fragen:A. Wie schätzen Sie Adrians Zeitplanung an diesem Vormittag ein? Begründen Sie Ihre Einschätzung in einigen Sätzen.B. Wo sehen Sie Optimierungsmöglichkeiten? Machen Sie einen konkreten Vorschlag.AktivitätenkontrolleTag, Datum: 18.02.20xxUhrzeit                             Aktivität                                                                                                                                                                                                                                                     Priorität         Soll-Zeit           Ist-Zeit08:20                          Computer gestartet, Tagesplanung                                                                                                                                                                    A                  0:10                0:10 08:30                          Arbeit an Projekt XY                                                                                                                                                                                             A                  0:40               0:25           08:55                          Anruf von D. bzgl. M.                                                                                                                                                                                            C                   -                    0:1009:05                          Unterlagen für D. kopiert, Papier aufgefüllt                                                                                                                                                        C                   -                    0:1509:20                          Projekt XY                                                                                                                                                                                                             A                    -                    0:3009:50                          Kaffeepause – Zeitung                                                                                                                                                                                 X*Fussnote         0:15                0:1010:00                          Schwätzchen mit Kollege R. über Schneechaos                                                                                                                                                X                     -                   0:0510:05                          Maileingang gecheckt, Mails beantwortet.                                                                                                                                                        B                   0:15                0:2510:20                          Gespräch mit G. über Kundenreklamation S.                                                                                                                                                     B                   0:10                0:1510:30                          Antwort an S., Information an B. geschickt                                                                                                                                                       B                    0:45               0:4011:10                           Kurzpause                                                                                                                                                                                                            X                    0:05               0:0511:15                           Projekt XY                                                                                                                                                                                                            A                    0:40               0:5512:10                          Dokumente zu Projekt XY weitergeleitet                                                                                                                                                           A                    0:15                0:1512:25                         Mittagspause                                                                                                                                                                                                       X                     1:00               1:00 ...                               ...",,11.0,connectsolutions_de,,,149,aR9fTh0BR8n6huaPo7tiDn,Adrian nehmen Aktivitatenkontrol nachfolgend finden Ausschnitt davon beantworten folgend Frage a schatzen adrian Zeitplanung Vormittag begrunden Einschatzung satzen b seh optimierungsmoglichkeiten konkret Vorschlag Aktivitatenkontrolletag Datum xxuhrzeit Aktivitat Prioritat Zeit Zeit Comput gestarten Tagesplanung -- Arbeit Projekt xy a Anruf d Bzgl m c unterlage fur d kopieren Papier aufgefullt c Projekt xy a kaffeepaus Zeitung x Fussnot schwatzch kolleg r uber Schneechao x Maileingang checken Mail beantworten b Gesprach G uber kundenreklam -- -- Antwort s Inform b geschickt -- kurzpaus x Projekt xy a Dokument Projekt xy weitergeleiten -- mittagspaus x,
16932,deu,"Um einen Konflikt zu analysieren und um zu begreifen, worum es wirklich geht, sind offene Fragen zu stellen, die es ermöglichen, die Situation besser zu verstehen. Welche Fragen könnte man stellen, um einen Konflikt zu analysieren? Gib zwei Beispiele.",,11.0,connectsolutions_de,DE_L_CM,,39,4aDyM3FpMml899eVlfeZsN,Konflikt analysieren begreifen worum wirklich gehen offen Frage stellen ermoglich Situat gut versteh Frage konnen stellen Konflikt analysieren gib zwei Beispiel,
16934,deu,"Unter «Mobbing» versteht man negative verbale und nonverbale Handlungen gegen eine Person über einen längeren Zeitraum. Mobbing hat verschiedene Merkmale, z. B. Angriffe auf die Möglichkeit, sich mitzuteilen. Welche anderen Mobbinghandlungen gibt es? Nenne mindestens ein Beispiel.",,11.0,connectsolutions_de,DE_L_CM,,37,9vgSAEaUd9D7YPrVUxRgwK,Mob verstehen Neg verbal nonverbal handlungen Person uber langeren Zeitraum Mob verschied Merkmal z b Angriff Moglichkeit mitteilen Mobbinghandlungen geben nenn mindest Beispiel,
16937,deu,Die Begrüssung und Gesprächseröffnung sind bei einem Konfliktgespräch sehr wichtig. Wie soll dabei vorgegangen werden?,,11.0,connectsolutions_de,DE_L_CM,,15,8loZvzzdKW168pozQTgLo3,Begrussung Gesprachseroffnung Konfliktgesprach wichtig dabei vorgehen,
16938,deu,"Widerstand gegenüber Veränderungen ist auf Angst vor Neuem zurückzuführen. Widerstand kann jedoch auch auf der Angst beruhen, Gewohnheiten, die Sicherheit und Wohlbefinden schaffen, aufgeben zu müssen. Welche anderen Ängste können bei Veränderungen auftreten?",,11.0,connectsolutions_de,DE_L_CM,,33,6fgiOl021yk6LX8Arq2qs0,Widerstand Gegenub veranderungen angst neu zuruckzufuhr Widerstand jedoch Angst beruhen gewohnheit Sicherheit wohlbefind Schaffe aufgeben mussen angst Konn veranderungen auftreten,
16939,deu,Für den konstruktiven Umgang mit Widerstand müssen gewisse Grundsätze beachtet werden. Welche?,,11.0,connectsolutions_de,DE_L_CM,,12,1DP4UsyOuL98mGHNpnRZSj,fur konstruktiv Umgang Widerstand Mussen Gewiss Grundsatz beachten,
16948,deu,"Formuliere deine Antwort mithilfe mehrerer Stichwörter.Nenne mindestens ZWEI Dimensionen/Lebensbereiche einer Person, die ein „Tyrann, Täter“ beeinträchtigen kann.",,11.0,connectsolutions_de,8. Wissen über Manipulationstechniken und ihre Auswirkungen haben,,17,1bE5K6vfUmkaLCVEop9wJM,Formulier Antwort Mithilf mehrer Stichwort nenn mindest zwei dimension Lebensbereich Person Tyrann tater beeintrachtigen,
16991,deu,"Gottfried Benn (1886–1956)Reisen (1950)Meinen Sie, Zürich zum Beispielsei eine tiefere Stadt,wo man Wunder und Weihenimmer als Inhalt hat?Meinen Sie, aus Habana,weiß und hibiskusrot,bräche ein ewiges Mannafür Ihre Wüstennot?Bahnhofstraßen und Rueen,Boulevards, Lidos, Laan –selbst auf den Fifth Avenueenfällt Sie die Leere an –Ach, vergeblich das Fahren!Spät erst erfahren Sie sich:bleiben und stille bewahrendas sich umgrenzende Ich.Benutzen Sie folgenden Formulierungsbaustein um die Einleitung Ihrer Interpretation zu beginnen.In dem Gedicht … von … aus dem Jahr … fragt das lyrische Ich …",,95.0,Cornelsen DE,Feedback,,79,2OCzVPx47hE9q61ls1ggvQ,Gottfri benn Reise zurich beispielsein tief Stadt Wunder Weihenimm Inhalt Habana wissen Hibiskusrot brechen ewig Mannafur Wustennot bahnhofstraß rueen Boulevard Lido Laan Fifth avenueenfallt leer ach vergeblich fahren spat erst erfahren bleiben still Bewahrenda umgrenzend benutzen folgend Formulierungsbaustein Einleitung Interpret beginnen Gedicht Jahr fragen lyrisch,
16999,deu,"Bitte geben Sie Ihre Antwort mit Stichwörtern oder in einem Satz an.Im Allgemeinen geht man davon aus, dass die Einleitung einer Präsentation 10 % der gesamten Präsentation ausmacht.Was ist Ihrer Meinung nach der Hauptzweck der Einleitung?",,11.0,connectsolutions_de,1. Strukturierung der Präsentation,,36,4xPeRWNXC0q7fn6mDCyxu1,Bitt geben Antwort stichwortern Satz allgemeinen gehen davon Einleitung prasent gesamt Prasent ausmachen Meinung Hauptzweck Einleitung,
17000,deu,"Bitte geben Sie Ihre Antwort mit einem Satz an. Was sollten Sie nach Ihrer Präsentation tun, um eine sinnvolle Bilanz ziehen zu können?",,11.0,connectsolutions_de,5. Transfer von Unterricht,,23,1WkeQbPvkBb7mpOxqLNTvA,Bitt geben Antwort Satz sollen Prasent tun sinnvol Bilanz ziehen Konn,
17002,deu,"Bitte geben Sie Ihre Antwort mit einem Satz an.Die Rhetorik ist ein wichtiges Kriterium für eine erfolgreiche Präsentation.Können Sie erklären, inwiefern?",,11.0,connectsolutions_de,3. Relevante Nutzung von Medien,,21,3uHho6mcwEV7GAKHDVc3a2,Bitt geben Antwort Satz Rhetorik wichtig Kriterium Fur erfolgreich prasent konn Erklare inwiefern,
17003,deu,"Bitte geben Sie Ihre Antwort mithilfe von Stichwörtern an.  Mit Rhetorik kann man an der Wirkung arbeiten, die man auf sein Publikum ausüben möchte, um es zu überzeugen. Nennen Sie zwei Beispiele für solche Redemittel.",,11.0,connectsolutions_de,5. Transfer von Unterricht,,35,1293GBkjDYEaXvgdCO44iO,Bitt geben Antwort Mithilf Stichworter Rhetorik Wirkung arbeiten Publikum ausuben Mocht uberzeugen nennen zwei Beispiel fur Redemittel,
17004,deu,"Bitte antworten Sie mit einem Stichwort.Welche Art von Hilfsmittel sollte man am besten verwenden, um eine Präsentation überzeugend zu gestalten und ihr eine größere visuelle Wirkung zu verleihen, wenn man innerhalb der Präsentation einige Zahlenangaben einflechten muss?",,11.0,connectsolutions_de,4. Visuelle Darstellung,,37,48N0CT2xnOw8t8MbJQ4bDg,Bitt antwort Stichwort Art Hilfsmittel gut verwend Prasent uberzeugend gestalt groß Visuel Wirkung verleihen innerhalb Prasent zahlenangab einflecht,
17009,deu,"Bitte antworten Sie mithilfe von Stichwörtern.Die Stimme ist ein wertvolles Hilfsmittel bei einer Präsentation. Die Klangfarbe unserer Stimme dem Raum und dem Publikum anzupassen oder die Sprechgeschwindigkeit zu mäßigen, sind essenzielle Stilmittel. Welches andere Beispiel können Sie für den richtigen Einsatz Ihrer Stimme bei einer Präsentation nennen?",,11.0,connectsolutions_de,3. Relevante Nutzung von Medien,,47,QfmhZzEz428ASC0rQCgyu,Bitt Antwort Mithilf Stichworter stimm Wertvol Hilfsmittel Prasent Klangfarb unser stimm Raum Publikum anpassen Sprechgeschwindigkeit maßig Essenziel stilmittel Beispiel Konn fur richtig Einsatz stimm Prasent nennen,
17013,deu,"Bitte geben Sie Ihre Antwort in einem Satz an. Es gilt allgemein, dass man einen großen Teil seiner Zeit und Energie in die Vorbereitungsphase einer Präsentation investiert.Was sind die Schlüsselelemente, die Sie im Hauptteil der Präsentation ansprechen sollten?",,11.0,connectsolutions_de,1. Strukturierung der Präsentation,,38,39EinglEC1N9NNPTRvDvVA,Bitt geben Antwort Satz gelten allgemein groß Teil Zeit Energi Vorbereitungsphas Prasent investieren schlusselelement Hauptteil Prasent ansprechen sollen,
17023,deu,Um welches Satzglied handelt es sich bei der fett markierten Wortgruppe?Vielleicht sinnt die blonde Postassistentin über ihre Zukunft nach.,,1.0,Lernnavi,Funktionale Bestimmung der Satzglieder,,19,2I6EiUtDRH07dfI7MQwTyt,Satzgli handeln Fett markiert Wortgrupp vielleicht sinnen Blond Postassistentin uber Zukunft,
17024,deu,"Beschreibe deinen Hund. Erwähne hierbei die Rasse, die Farbe, die Größe, das Alter und was dir sonst noch einfällt.",,95.0,Cornelsen DE,,,19,s8jsymMwfZ7Fn4A59dRSU,beschreib Hund erwahn hierbei Rass Farb groß Alter einfallt,
17026,deu,Schreiben den Satz im Präteritum.Gestern - erzählen - ich - eine Geschichte.,,95.0,Cornelsen DE,,,12,4zCCSDzZTms68NuZVvcVct,schreiben Satz Prateritum gestern erzahlen schichen,
17027,deu,"Erkläre, warum es aus ethischer Sicht wichtig ist, Daten zu schützen.",,11.0,connectsolutions_de,,,11,7zfjwIwagx5az8LCkxXHsO,Erklar warum ethisch Sicht wichtig daten schutzen,
17028,deu,Nenne einen Vor- UND einen Nachteil des Verfahrens mit Übermittlungsbogen/Laufzettel.,,11.0,connectsolutions_de,,,10,7SD9u9MoZjYaAhDd6kLBRo,nenn Nachteil Verfahren ubermittlungsbog Laufzettel,
17029,deu,"Gib eine Eigenschaft an, die eine Idee haben muss, um in ein Projekt münden zu können:",,11.0,connectsolutions_de,,,16,3fXs9eN4lDd7hkGplAKFO3,gib eigenschaft ide Projekt mund Konne,
17030,deu,Was ist ein Input aus der Sicht eines Prozesses zur Befriedigung eines Kundenbedürfnisses?,,11.0,connectsolutions_de,,,13,9oRkVfq3T2P6F9BloLII3S,Input Sicht Prozess Befriedigung Kundenbedurfniss,
17031,deu,Was ist ein Output aus der Sicht eines Prozesses zur Befriedigung eines Kundenbedürfnisses?,,11.0,connectsolutions_de,,,13,8D1z6MPJmr65Takllixd2i,Output Sicht Prozess Befriedigung Kundenbedurfniss,
17032,deu,"Welcher Begriff bezeichnet die Situation, in der der Output eines Prozesses auch der Input eines anderen ist?",,11.0,connectsolutions_de,,,17,3WLihIbee4L8jhzHkIfzSf,Begriff bezeichnen Situat Output Prozess Input,
17037,deu,"Beschreibe in einem bis zwei Sätzen, welche Probleme im Umgang mit den Flüchtlingen deutlich werden.",,8.0,demo,,,15,2JIQtvavj715NCtZBhwpKb,beschreib zwei satzen Problem Umgang Fluchtling deutlich,
17042,deu,Bilde den Satz im Konjunktiv 2.Florian - gerne ein neues Auto haben.,,52.0,demo_DE,,,12,7Pv0gEhr6Xc8mgGlUvktVK,Bild Satz Konjunktiv Florian gern neu Auto,
17050,deu,"Nenne einen Hinweis, den uns das Journal liefert.",,11.0,connectsolutions_de,,,8,9YNgZK9qGs3aIva1dwBYZa,nenn Hinwei Journal liefern,
17051,deu,"Welches sind die zwei Dinge, für die das Hauptbuch im Laufe eines Jahres verwendet wird?",,11.0,connectsolutions_de,,,15,5NM4ASUhva5aCNnFd8qMlv,zwei Ding fur Hauptbuch lauf Jahr verwenden,
