language,description,context,tenant_id,tenant_name,topic_name,topic_description,word_count,taskId,preprocess_desc,preprocess_context
17655,deu,"Die Theorie X von McGregor stellt einen Teufelskreis dar.Erkläre in einem Satz, warum.","2.1 Menschenbild
Das Menschenbild bezeichnet die allgemeine Einstellung gegenüber anderen Menschen. Es wird von Bezugspersonen seit unserer frühesten Kindheit vermittelt, ist das Ergebnis von Erfahrungen, Beobachtungen und Emotionen und wird dadurch umso stärker in uns verankert. Unsere Einstellung filtert, wie wir andere Menschen und Situationen wahrnehmen. Wenn wir neuen Menschen oder Situationen begegnen, sind wir nämlich nicht so offen und unvoreingenommen, wie wir sein könnten. Stattdessen haben wir bereits ein bestimmtes Bild, das wir möglichst bestätigen möchten. Unsere Einstellung steuert also auch unser Denken, unsere Gefühle und unser Verhalten. In alltäglichen Situationen bleibt sie meist verborgen. Wenn wir jedoch unter starkem inneren Druck stehen, können wir uns oft nicht mehr kontrollieren. In diesem Fall entladen sich diese unterschwelligen Gefühle in einem Verhalten, das bei anderen Irritationen hervorruft.FremdwahrnehmungFremdwahrnehmungVon einer Führungskraft wird erwartet, dass sie über eine gute Kenntnis des menschlichen Verhaltens verfügtFremdwahrnehmung bedeutet, dass sie andere Menschen so gut einschätzen kann, dass sie ihre besonderen Eigenschaften, Fähigkeiten und Einstellungen schnell und zutreffend beurteilen kann.Wahrnehmung ist die Bewertung, Einordnung und Interpretation von Informationen, die uns in Form von Reizen aus der Umwelt und dem Körper zukommen. Dieser Rekonstruktionsprozess, der im Gehirn stattfindet, wird in vier Phasen unterteilt.
1) Persönliche Wahrnehmung: Was beobachte ich? 2) Interpretation der Wahrnehmung: Was fällt mir auf? 3) Emotionen: Welche Reaktion löst das in mir aus? 4) Urteil: Was denke ich darüber? Der vierte Schritt des Rekonstruktionsprozesses, das Urteil, filtert unsere Wahrnehmung noch einmal. Sie ist also immer...
- subjektiv: Was wir in einer Situation oder an einer anderen Person bemerken, ist bereits gefiltert. Aus der Fülle der Informationen haben wir diejenigen herausgefiltert, die uns besonders wichtig erscheinen, und sie uns auf eine bestimmte Art und Weise dargestellt. Eine andere Person würde die gleiche Situation oder die gleiche Person wahrscheinlich anders einschätzen.
- selektiv: Wir wählen einen bestimmten Ausschnitt aus dem Gesamtbild aus und interpretieren ihn, weil wir nicht in der Lage sind, alle Aspekte auf die gleiche Weise zu erfassen. Oft sind uns die Kriterien für diese Auswahl nicht bewusst, aber wir bestätigen damit insgeheim unsere Erwartungen: Wir sehen die andere Person so, wie wir sie sehen wollen.
Bereits in der Kindheit prägen wir durch unsere Erfahrungen ein bestimmtes Wahrnehmungsmuster. In vielen Situationen erweist sich dieses Muster als sehr nützlich. Wenn wir alle Informationen, die uns jedes Mal erreichen, völlig neu interpretieren und bewerten müssten, wären wir schnell überfordert. Gleichzeitig dienen uns die Wahrnehmungsmuster aber auch als ""Scheuklappen"" und lassen uns typische Urteilsfehler begehen. Diese sagen mindestens genauso viel über uns aus wie über die Situation oder die Person, um die es geht.

2.1.2. X- und Y-Theorien (McGregor)McGregors X- und Y-Theorien.
Wie sehen Führungskräfte ihre Mitarbeiter als Menschen? Was sind die Hauptgründe, die einen Mitarbeiter dazu veranlassen, sich bei der täglichen Arbeit zu engagieren? Die von McGregor entwickelten Theorien X und Y beschreiben zwei gegensätzliche Menschenbilder (zwei Motivationsstrukturen).
Theorie X: Der durchschnittliche Mensch hat von Natur aus eine angeborene Abneigung gegen Arbeit und wird alles tun, um diese zu vermeiden.Deshalb müssen die meisten Menschen geführt, kontrolliert und unter Androhung von Sanktionen gezwungen werden, einen produktiven Beitrag zur Erreichung der Ziele der Organisation zu leisten.Der durchschnittliche Mensch bevorzugt es, geführt zu werden: Er scheut die Verantwortung, hat relativ wenig Ehrgeiz und strebt vor allem nach Sicherheit.Theorie X: Der durchschnittliche Mensch wird von Natur aus eine angeborene Abneigung gegen Arbeit haben und wird alles tun, um diese zu vermeiden.Theorie X: Die meisten Menschen müssen geführt, kontrolliert und gezwungen werden, einen produktiven Beitrag zur Erreichung der Ziele der Organisation zu leisten.
Theorie Y: Wenn sich der Mitarbeiter mit den Zielen der Organisation identifiziert, wird externe Kontrolle überflüssig und er entwickelt einen Sinn für Selbstkontrolle und Eigeninitiative.Der Durchschnittsmensch hat keine angeborene Abneigung gegen die Arbeit. Die wichtigsten Belohnungen sind die Befriedigung des Egos und des Bedürfnisses nach Selbstverwirklichung, nicht finanzielle Vorteile.Der durchschnittliche Mensch kann nach Verantwortung streben, um seine Ideen und seine Kreativität optimal zu mobilisieren.

2.1.3. Auswirkungen des Menschenbildes auf die Führung
Das Menschenbild der Führungskraft spiegelt sich in ihrem Umgang mit den Mitarbeitern wider und umgekehrt. Es beeinflusst sein Verhalten als Führungskraft und damit auch das Verhalten der Mitarbeiter. So fühlt sich die Führungskraft in ihrem Menschenbild bestätigt: ""So sind die Menschen eben!"". Daraus lässt sich ableiten, dass die Kompetenz und Motivation der Mitarbeiter auch vom Menschenbild der Führungskraft abhängt.Theorie X und Theorie Y beinhalten auch die Dynamik der sich selbst erfüllenden Prophezeiung.Theorie X ist ein Teufelskreis. Weil der Vorgesetzte glaubt, dass seine Mitarbeiter nicht gerne arbeiten, ""führt er sie an der Nase herum"", indem er strenge Regeln aufstellt, was die natürliche Abneigung der Mitarbeiter gegen die Arbeit verstärkt und neue Regeln erforderlich macht.In Theorie Y hingegen geht der Vorgesetzte davon aus, dass seine Mitarbeiter gerne arbeiten, und gewährt ihnen daher einen gewissen Handlungsspielraum bei der Erfüllung ihrer Aufgaben. So entsteht ein positiver Kreislauf: Der Mitarbeiter investiert mehr Zeit in seine Arbeit und führt sie gerne aus, ohne dass er beaufsichtigt werden muss",148.0,connectsolutions_playground2,2. Relationale Intelligenz,,13,abxzFd4syMp7p5i54YsGyc,Theori x Mcgregor stellen teufelskrei dar erklar Satz warum,Menschenbild Menschenbild bezeichnen allgemein Einstellung Gegenub Mensch bezugspersonen seit unser fruhest Kindheit vermitteln Ergebni Erfahrung beobachtung Emotion dadurch umso stark verankern Einstellung filtert Mensch Situation wahrnehmen neu Mensch Situation begegnen namlich offen unvoreingenommen können stattdessen bereit bestimmen Bild moglichst bestatig mochten Einstellung steuern denken Gefuhl verhalten alltaglich Situation bleiben meist verbergen jedoch stark innerer Druck stehen Konn oft mehr kontrollieren Fall entlad unterschwellig Gefuhl verhalten irritation Hervorruft fremdwahrnehmungfremdwahrnehmungvon Fuhrungskraft erwarten uber gut Kenntni menschlich verhalten Verfugtfremdwahrnehmung bedeuten Mensch gut einschatzen besonderer eigenschaft Fahigkeit Einstellung schnell zutreffend beurteil Wahrnehmung Bewertung Einordnung interpret information Form Reize Umwelt Korper zukommen Rekonstruktionsprozess Gehirn stattfinden vier Phase unterteilt personlich Wahrnehmung beobachen interpret Wahrnehmung fallen emotion Reaktion Lost Urteil denk Darub viern Schritt rekonstruktionsprozess Urteil filtern Wahrnehmung immer subjektiv Situat Person bemerken bereit filtern full Information derjenige herausgefiltern besond wichtig erscheinen bestimmen Art Weis darstellen Person Wurd gleich situat gleich Person wahrscheinlich einschatzen selektiv wahl bestimmt Ausschnitt Gesamtbild interpretieren Lage Aspekt gleich Weis erfassen oft kriterien fur Auswahl bewussen Bestatige insgeheim Erwartung sehen Person sehen Bereit Kindheit prag Erfahrung bestimmen Wahrnehmungsmust vieler Situation Erweist Muster nutzlich Information mal erreichen vollig neu interpretieren bewerten Musst schnell uberfordert gleichzeitig dienen Wahrnehmungsmust Scheuklappe lassen typisch urteilsfehl begehen sagen mindest genauso uber uber Situat Person gehen x Y Theorien Mcgregor Mcgregor x Y Theorie sehen Fuhrungskraft Mitarbeit Mensch hauptgrund Mitarbeit veranlassen taglich Arbeit engagieren Mcgregor entwickelt Theorie x Y beschreiben zwei gegensatzlich Menschenbild zwei Motivationsstrukture Theori x durchschnittlich Mensch Natur angeboren Abneigung Arbeit tun vermeiden deshalb muss meister Mensch fuhren kontrollieren Androhung sanktion zwingen produktiv Beitrag Erreichung Ziel Organis leisten durchschnittlich Mensch bevorzugen fuhren scheuen Verantwortung relativ wenig Ehrgeiz streben Sicherheit Theori x durchschnittlich Mensch Natur angeboren Abneigung Arbeit tun vermeiden Theori x meister Mensch Mussen Gefuhrt kontrollieren gezwung produktiv Beitrag Erreichung Ziel Organis leisten theori Y Mitarbeit ziel Organis identifizieren extern kontrol uberflussig entwickeln Sinn fur Selbstkontrol Eigenin durchschnittsmensch angeboren Abneigung Arbeit wichtig belohnung Befriedigung ego Bedurfniss Selbstverwirklichung Finanziel Vorteil durchschnittlich Mensch Verantwortung streben Idee Kreativitat Optim mobilisier auswirkung Menschenbild Fuhrung Menschenbild Fuhrungskraft spiegeln Umgang Mitarbeiter wider umgekehrt beeinflussen verhalten Fuhrungskraft verhalten Mitarbeit fuhlt Fuhrungskraft Menschenbild bestatigen Mensch eben Darau lassen ableit Kompetenz Motiv Mitarbeit Menschenbild Fuhrungskraft abhangen Theori x Theori Y beinhalt Dynamik erfullenden Prophezeiung Theori x Teufelskrei vorsetzen glauben Mitarbeit gern arbeiten Fuhrt Nase herum streng Regel aufstellen naturlich Abneigung Mitarbeit Arbeit verstarken neu Regel erforderlich machen Theori y hingegen gehen vorsetzen davon Mitarbeit gern arbeiten wahren daher gewiß Handlungsspielraum Erfullung Aufgabe entstehen positiv Kreislauf Mitarbeit investieren mehr Zeit Arbeit fuhrt gern beaufsichtigen
17657,deu,"Erkläre, wieso man die Meeresschildkröte an der Wasseroberfläche gespiegelt sieht.","Dieses dekorative Leuchtobjekt besteht aus vielen sehr dünnen durchsichtigen Fasern, aus deren Enden helles Licht austritt. Wieso können durchsichtige Glasfasern Licht leiten?   In Lichtleiterlampen wird Licht in Glas- oder Kunststofffasern geleitet, sogar über gekrümmte Wege. Das funktioniert auch mit einer „Wasserfaser“. Ein Lichtbündel tritt von links in den Auslauf eines Wasserbechers ein. Es „folgt“ dem Wasserstrahl, ohne ihn seitlich zu verlassen. Beim Übergang von einem optisch dichteren Stoff (wie Wasser) zu einem optisch dünneren Stoff (wie Luft) ist der Brechungswinkel immer größer ist als der Einfallswinkel. Die Bilder a) bis c) zeigen, dass bei einem bestimmten Einfallswinkel der Brechungswinkel 90° erreicht wird. Diesen Einfallswinkel nennt man Grenzwinkel α G . Ist der Einfallswinkel größer als der Grenzwinkel, kann keine Brechung mehr auftreten, das gesamte Licht wird reflektiert. Dieser Fall wird als Totalreflexion bezeichnet. In der Tabelle sind die Grenzwinkel für verschiedene Stoffpaare angegeben: Stoffpaar Grenzwinkel Wasser / Luft 49° Glas / Luft 42° Rubin / Luft 34° Diamant / Luft 24° Die folgende Abbildung zeigt ein Lichtbündel, das durch eine dünne Glasfaser geleitet wird. Der Einfallswinkel des Lichtbündels ist immer größer als der Grenzwinkel beim Übergang Glas-Luft. Das Licht wird also total reflektiert. Auch in Glasprismen kann eintretendes Licht total reflektiert werden. Die Abbildung zeigt ein Umkehrprisma und ein 90°-Prisma. Solche Prismen werden in optischen Geräten, z. B. Ferngläsern, verwendet. Sie können Spiegel ersetzen.   Beim Übergang vom optisch dichteren zum optisch dünneren Stoff kann Totalreflexion auftreten. Dazu muss der Einfallswinkel größer als der Grenzwinkel sein.",140.0,EKV_Physik,,,10,3Dv5AAXYgqj8adX5uQOsXl,Erklar Wieso Meeresschildkrot wasseroberflach spiegeln sehen,dekor leuchtobjekt bestehen vieler Dunn durchsichtigen fasern der end Hell Licht Austritt wieso konn durchsichtig glasfasern Licht leit Lichtleiterlampe Licht gla kunststofffasern leiten sogar uber gekrummt Weg funktionieren Wasserfas Lichtbundel treten link Auslauf Wasserbech folgen Wasserstrahl seitlich verlassen bei Ubergang optisch dichter Stoff Wasser optisch dunneren Stoff Luft Brechungswinkel immer groß Einfallswinkel Bild a C zeigen bestimmt Einfallswinkel Brechungswinkel erreichen Einfallswinkel nennen Grenzwinkel α g Einfallswinkel groß Grenzwinkel Brechung mehr auftret Gesamt Licht reflektieren Fall Totalreflexion bezeichnen tabel Grenzwinkel fur verschiede Stoffpaar angeben Stoffpaar Grenzwinkel Wasser Luft gla Luft Rubin Luft diamant Luft folgend Abbildung zeigen Lichtbundel Dunn Glasfas leiten Einfallswinkel Lichtbundel immer groß Grenzwinkel bei Ubergang gla Luft Licht total reflektieren Glasprismen eintretend Licht total reflektieren Abbildung zeigen Umkehrprisma prisma prism optischen geraten z b fernglasern verwenden konn Spiegel ersetzen bei Ubergang optisch dichteren optisch dunneren Stoff Totalreflexion auftret Einfallswinkel groß Grenzwinkel
17658,deu,Spielt die Form der Blendenöffnung bei der Lochkamera eine Rolle? Begründe deine Entscheidung.,"An einem sonnigen Tag sieht man bei einem Waldspaziergang helle runde Flecke am Boden. Das Licht der Sonne strahlt durch die unregelmäßigen Lücken im Blätterdach. Warum aber sind diese „Sonnentaler“ kreisrund?   Im Zeitalter von Kameras mit Millionen von Speicherpunkten kann man sich kaum mehr vorstellen, dass man ganz ohne digitale Hilfsmittel ein Bild erzeugen kann. Darum denkt auch beim oben abgebildeten Waldweg niemand an eine Kamera. Aber die einfachste Kamera, die sogenannte camera obscura (lat. für dunkles Zimmer) gibt es schon seit zweitausend Jahren. Sie besteht aus einem dunklen Raum (Kammer, Pappkarton oder eben ein schattiger Waldweg), in den nur durch ein kleines Loch Licht gelangt. Die Abbildung zeigt, wie in einer Lochkamera das Bild einer Kerze entsteht: Von jedem Punkt der leuchtenden Flamme breitet sich das Licht geradlinig in alle Richtungen aus. Je ein schmales Lichtbündel gelangt durch das kleine Loch (die „Blende“) und erzeugt auf dem gegenüberliegenden Schirm ein Bildscheibchen. Insgesamt ergibt sich das Bild der ganzen Flamme. Das Bild steht jedoch auf dem Kopf und ist seitenverkehrt. Genauso verhält es sich beim Waldweg. Die kleinen Lücken im Blätterdach wirken wie Blenden und wie die Flamme wird hier die kreisrunde Sonne auf den Weg abgebildet. Je kleiner das Loch, desto dunkler, aber schärfer ist das Bild; je größer die Blende, desto heller, aber unschärfer ist das Bild. Denn bei einer großen Blende gelangen breite Lichtbündel ins Innere der Kamera, die sich auf dem Schirm überlappen. Es entsteht kein scharfes Bild mehr. Mangels Zoomobjektiv muss man sich vor dem Fotografieren mit der Lochkamera Gedanken über die Größe des Bildes B und des Gegenstands G machen. Wie groß das Bild auf dem Schirm wird, hängt von der Größe des abgebildeten Gegenstands G , von seiner Entfernung zur Blende g und vom Abstand des Schirms zur Blende b ab. Je näher man bei einer bestimmten Gegenstandsgröße an den Gegenstand heran geht, desto größer ist das Bild auf unserem Schirm.   Eine Anordnung aus Lochblende und Schirm mit einem Gehäuse bezeichnet man als Lochkamera. Auf dem Schirm einer Lochkamera entsteht ein Bild. Je kleiner die Blendenöffnung ist, desto schärfer, aber dunkler ist das Bild.",140.0,EKV_Physik,,,13,1yGmHUWBaOS9s7NQgVX03j,spielen Form Blendenoffnung Lochkamera roll Begrund Entscheidung,sonnigen Tag sehen Waldspaziergang Hell rund Fleck Boden Licht Sonn strahlen Unregelmaßig Lucke Blatterdach warum Sonnental kreisrund Zeitalt Kamera Million speicherpunkn kaum mehr vorstellen ganz Digital Hilfsmittel Bild erzeugen darum denken bei oben abgebildeten Waldweg niemand Kamera einfachst Kamera Sogenannt Camera Obscura Lat fur Dunkl zimmer geben schon seit zweitausend Jahr bestehen dunkel Raum Kammer Pappkarton eben schattig Waldweg klein Loch Licht gelangen Abbildung zeigen Lochkamera Bild Kerz entstehen Punkt leuchtend Flamm breiten Licht Geradlinig Richtungen je schmal Lichtbundel gelangen klein loch Blend erzeugen gegenuberliegend Schirm bildscheibchen insgesamt ergeben Bild ganz Flamm Bild stehen jedoch Kopf seitenverkehren genauso Verhalt bei Waldweg klein lucken Blatterdach wirken blend Flamm Kreisrund Sonn abgebildet je klein Loch desto dunkl scharf Bild je groß Blend desto hell unscharf Bild groß Blend gelangen Breit Lichtbundel inn Kamera Schirm uberlappen entstehen scharf Bild mehr Mangel zoomobjektiv fotografieren Lochkamera Gedanke uber groß Bild b Gegenstand G groß Bild Schirm hangen groß abgebildeten Gegenstand G Entfernung Blend g Abstand Schirm Blend b ab je nah bestimmt Gegenstandsgroß Gegenstand heran gehen desto groß Bild Schirm Anordnung Lochblend Schirm Gehaus bezeichnen Lochkamera Schirm Lochkamera entstehen Bild je klein Blendenoffnung desto scharf Dunkler Bild
17659,deu,Lochblenden und Sammellinsen erzeugen Bilder leuchtender Gegenstände. Nenne Gemeinsamkeiten und Unterschiede der Bilder. Erkläre sie mit der unterschiedlichen Bildentstehung.,"Mit dieser Sammellinse werden zwei Bilder vom Fenster, das sich hinter dem Betrachter befindet, erzeugt. Eines davon wird auf der Wand aufgefangen. Nur in einem bestimmten Abstand der Linse von der Wand ist dieses Bild scharf. Wodurch unterscheidet sich die Abbildung an der Wand von dem Bild, das man auf der Linse sieht?   Das Bild des Fensters auf der Wand ist seitenverkehrt und steht auf dem Kopf, während das Spiegelbild auf der Linse aufrecht steht. Das Bild des Fensters an der Wand ist kleiner als das Fenster selbst. Die Abbildung zeigt, wie das umgedrehte Bild entsteht. Licht, das von der Spitze der Kerzenflamme ausgeht und auf die Linse trifft, wird durch die Linse so gebrochen, dass es hinter der Linse nach unten zusammengeführt wird. Licht, das vom Docht ausgeht, wird durch die Linse nach oben gebrochen und zusammengeführt. Alle diese Bildpunkte entstehen nur in einem bestimmten Abstand hinter der Linse. Die Abstände von Bild und Gegenstand zur Linsenmitte (Bildweite und Gegenstandsweite) müssen zueinander passen, sonst ist das Bild unscharf. Die Bildgröße hängt von der Gegenstandsweite ab. In der Abbildung ist sie gerade so groß, dass Kerze und Bild der Kerze gleich groß sind. Das Bild der Kerze existiert auch ohne Schirm! Entfernt man den Schirm und blickt von hinten in Richtung Linse, so sieht man das Bild im Raum schweben: An der Stelle, wo der Schirm vorher war. Staub oder Nebel an dieser Stelle lassen das Bild besser erkennen. Auch mit einer wassergefüllten Glaskugel kann ein Bild erzeugt werden. Die Wasserkugel wird zur Linse, wenn wir sie uns in einen Würfel und zwei Kugelkappen zerlegt denken. Die Flächen des Würfels verschieben Lichtstrahlen beim Durchgang nur wie eine dicke Glasplatte. Die beiden gekrümmten Oberflächen der Kugelkappen wirken wie eine Sammellinse.   Mit dem dargestellten Versuchsaufbau lässt sich herausfinden, welchen Abstand Lichtquelle, Linse und Schirm zueinander haben müssen, damit das Bild scharf ist. Zur Beschreibung der Abstände werden zwei Begriffe benötigt: Der Abstand von der Linse zum Schirm heißt Bildweite b , der Abstand vom Gegenstand zur Linse heißt Gegenstandsweite g . Die Kerze soll aus einer sehr großen Gegenstandsweite immer näher zur Linse geschoben werden. Dabei wird jeweils die Bildweite so verändert, dass ein scharfes Bild auf dem Schirm entsteht. Zunächst stellt man fest, dass dies für jede Gegenstandsweite höchstens bei einer einzigen Bildweite gelingt, d. h., um ein scharfes Bild zu erhalten, muss zu jeder Gegenstandsweite eine ganz bestimmte Bildweite eingestellt werden. Bei sehr großer Gegenstandsweite verändert sich die Schärfe des Bildes zunächst allerdings kaum, wenn eine etwas zu große oder zu kleine Bildweite eingestellt wird. Je kleiner die Gegenstandsweite wird, desto genauer muss man die Bildweite einstellen, um eine scharfes Bild zu erhalten. Das scharfe Bild steht in allen Fällen auf dem Kopf und es wird größer, wenn die Gegenstandsweite abnimmt. Ist die Gegenstandsweite sehr klein, entsteht gar kein Bild auf dem Schirm. Bei genauer Untersuchung lassen sich mehrere Fälle unterscheiden: g > 2 f , d.h., die Gegenstandsweite ist größer als die doppelte Brennweite der Sammellinse: Das Bild ist kleiner als das Original. g = 2 f , d.h., die Gegenstandsweite ist gleich der doppelten Brennweite: Das Bild ist so groß wie das Original und die Bildweite ist gleich der doppelten Brennweite ( b = 2 f ). f < g < 2 f , d.h., die Gegenstandsweite liegt zwischen der einfachen und doppelten Brennweite: Das Bild ist größer als das Original und die Bildweite ist größer als die doppelte Brennweite ( b > 2 f ). g ≤ f , d.h., die Gegenstandsweite ist gleich der Brennweite oder kleiner als die Brennweite: Auf dem Schirm entsteht kein Bild .",140.0,EKV_Physik,,,19,E7x6BYONFk8s9yhgeTguo,lochblend Sammellinse erzeug Bild leuchtend Gegenstand nenn gemeinsamkeit Unterschied Bild erklar unterschiedlich Bildentstehung,Sammellin zwei Bild Fenster betracht befinden erzeugen davon Wand aufgefang bestimmt Abstand Lins Wand Bild scharf wodurch unterscheiden Abbildung Wand Bild Lins sehen Bild Fenster Wand seitenverkehren stehen Kopf wahrend Spiegelbild Lin aufrecht stehen Bild Fenster Wand klein Fenster Abbildung zeigen umgedrehen Bild entstehen Licht spitz Kerzenflamm ausgehen Lins treffen lins brechen Lins unten Zusammengefuhrt Licht Docht ausgehen lins oben brechen Zusammengefuhrt Bildpunkt entstehen bestimmt Abstand lins Abstand Bild Gegenstand linsenmeiden Bildweit Gegenstandsweit mussen Zueinand passen Bild unscharf Bildgroß hangen Gegenstandsweit ab Abbildung gerad Groß Kerz Bild Kerz gleich groß Bild Kerz existieren Schirm entfernt Schirm blicken hinten Richtung Lins sehen Bild Raum schweben stell Schirm vorher Staub Nebel stell lassen Bild gut erkennen wassergefullen Glaskugel Bild erzeugen Wasserkugel Lins Wurfel zwei Kugelkappe zerlegt denk flach Wurfel verschieben lichtstrahlen bei Durchgang Dick Glasplatt beide gekrummt oberflach Kugelkappe wirken Sammellin dargestellt Versuchsaufbau lassen herausfind Abstand Lichtquel Lins Schirm Zueinand muss Bild scharf Beschreibung Abstand zwei Begriff benotigen Abstand Lins Schirm heißen Bildweit -- Abstand Gegenstand Lins heißen Gegenstandsweit G Kerz groß Gegenstandsweit immer nah Lins schieben dabei jeweil Bildweit verandern scharf Bild Schirm entstehen zunachst stellen fest fur Gegenstandsweit hochsten einzig Bildweit gelingen d h scharf Bild erhalten Gegenstandsweit ganz bestimmt Bildweit einstellen groß Gegenstandsweit verandern scharf Bild zunachst Allerd kaum groß Klein Bildweit einstellen je klein Gegenstandsweit desto genau Bildweit einstellen scharf Bild erhalten scharf Bild stehen fallen Kopf groß Gegenstandsweit abnehmen Gegenstandsweit klein entstehen gar Bild Schirm genau Untersuchung lassen Mehrer Fall unterscheiden g f d h Gegenstandsweit groß doppelt Brennweit sammellins Bild klein Origin g f d h Gegenstandsweit gleich doppelt Brennweit Bild Groß Origin Bildweit gleich doppelt Brennweit b f f g f d h Gegenstandsweit liegen einfach Doppelt Brennweit Bild groß Origin Bildweit groß doppelt Brennweit b f g f d h Gegenstandsweit gleich Brennweit klein Brennweit Schirm entstehen Bild
