language,description,context,tenant_id,tenant_name,topic_name,topic_description,word_count,taskId,preprocess_desc,preprocess_context
17811,deu,Beschreiben Sie das Hochschleudern von Gegenständen mit Hilfe eines Federkatapults aus energetischer Sicht. Skizzieren Sie das zugehörige Energiekontenmodell.,"Der Schiffsarzt Robert Mayer notierte 1840/41 in seinem Tagebuch „verworrene Ideen über die Umwandlung von Bewegung in Wärme“. Gleichzeitig meinte er, „ein neues System der Physik mitgebracht“ zu haben. Die Fachwelt begegnete ihm damals abweisend. Heute folgt man seiner Idee der Erhaltungsgrößen.   Die freie Fahrt auf der Achterbahn beginnt von einem hoch gelegenen Startpunkt aus. Die Geschwindigkeit der Wagen nimmt bergab zu und bergauf ab. Während der Fahrt ändern sich Höhe und Geschwindigkeit der Wagen ständig. Für sich gesehen, sind diese Größen relativ; sie kennzeichnen den Zustand der Wagen erst, wenn Wagen, Bahn und Erde als zusammengehörig aufgefasst werden. In der Physik betrachtet man daher alle Körper, die zur eindeutigen Beschreibung eines Vorganges nötig sind, als ein System . Ein fallender Flummi wird immer schneller. Beim Aufprall auf dem Boden wird er auf kurzer Strecke auf v = 0 m s abgebremst, verformt sich dabei und springt wieder hoch. Die sich ändernden Größen Geschwindigkeit, Höhe und Verformung zeigen verschiedene Zustände des Systems „Ball – Erde“ an. In der Physik hat sich die Vorstellung entwickelt, dass es bei allen beobachtbaren Veränderungen eine unveränderliche Größe gibt. Diese Größe heißt Energie . Um quantitative Aussagen über die Energie machen zu können, geht man von zwei Annahmen aus: Energie wird durch Größen erfasst, die im jeweiligen Zustand des Systems messbar sind, und zwar durch die Höhe h , für die Höhenenergie E H , Geschwindigkeit v , für die Bewegungsenergie E B , Verformung s , für die Spannenergie des Systems E S , Es dürfen sich die zur Beschreibung der Energie verwendeten Größen nur durch Wechselwirkungen mit Körpern des Systems ändern. Man spricht von einem abgeschlossenen System , weil dann z.B. keine Energie das System verlässt. Sie ist eine Konstante des Systems, die Energie bleibt erhalten. Man betrachtet einen Gleiter, der auf einer Luftkissenbahn von einem herabsinkenden Antriebsgewicht beschleunigt wird (siehe Experiment Die Bewegungsenergie ): Solange im System „Erde, Luftkissenbahn, Gleiter und Antriebsmasse“ keine weiteren Energieüberführungen stattfinden, das System also abgeschlossen ist, lässt sich seine mechanische Energie durch zwei Terme beschreiben: Höhenenergie: E H = m · g · h Bewegungsenergie: E B = 1 2 m · v 2 Die Terme ergeben als Einheit für die Energie 1 kg · m 2 · s - 2 = 1 J (1 Joule). Der Wert der Höhenenergie hängt von der Festlegung des Nullniveaus für die Höhe ab. Wird Höhenenergie in Bewegungsenergie überführt, so kommt es nur auf die Höhendifferenz von Ausgangs- und Endlage an, die unabhängig vom Bezugsniveau ist. Die Änderung der Bewegungsenergie wird entsprechend durch die Differenz der Quadrate von Anfangs- und Endgeschwindigkeit bestimmt. Eine sich entspannende Feder kann einen reibungsarm gelagerten Gleiter beschleunigen (siehe Experiment Die Spannenergie ). Hierbei wird Spannenergie in Bewegungsenergie überführt. Aus Masse und Geschwindigkeit des Gleiters kann der zugehörige Term hergeleitet werden: Spannenergie: E S = 1 2 D · s 2 Terme für die mechanische Energie Wird in der Abbildung die Achterbahn mit ihren Wagen und der Erde als abgeschlossenes System betrachtet, so ist ihre Gesamtenergie konstant. Sie ist für jeden Zeitpunkt der Bewegung die Summe aus der Höhenenergie E H und der Bewegungsenergie E B , wobei sich deren Anteile laufend ändern können. Höhe und Geschwindigkeit lassen sich aus den Energietermen bestimmen, so z.B. die Geschwindigkeit im höchsten Punkt eines Loopings. Ob sie ausreicht, den höchsten Punkt ohne herunterzufallen zu durchfahren, kann aber erst durch eine Betrachtung der Kräfte beurteilt werden. Mit dem Energiekonzept können auch ohne Kenntnis der Bewegungsgleichungen einige zur Beschreibung einer Bewegung wichtige Größen bestimmt werden. Das Energiekonzept liefert keine Angaben zum zeitlichen Ablauf. Die „durchfallene“ Höhe h 0 führt unabhängig von der Bahnkurve stets zur selben Endgeschwindigkeit. Wie lange die Bewegung dauert, ist damit nicht gesagt. Bei einem hüpfenden Flummi werden Höhenenergie E H , Bewegungsenergie E B und Spannenergie E S ineinander überführt. Die Beträge der einzelnen Anteile können mit farbigen Anzeigen – dem Energiekontenmodell – dargestellt werden. Betrachtet man Flummi und Boden als abgeschlossenes System, müsste der Ball nach dem Aufprall wieder seine Ausgangshöhe erreichen, es liegt dann nur Höhenenergie vor. Bei reibungsfreien Vorgängen gilt der Energieerhaltungssatz der Mechanik, nach dem die Gesamtenergie eines abgeschlossenen mechanischen Systems als Summe von Höhenenergie, Bewegungsenergie und Spannenergie konstant ist. Durch Reibung wird dem System Energie entzogen, die als thermische Energie nicht mehr vollständig in mechanische Energie ​​ E H ​​ , ​​ E B ​​ und ​​ E S ​​ umsetzbar ist. Das System ist bei Reibung nicht mehr abgeschlossen. Dies zeigt sich beim Flummi: Seine Sprunghöhe nimmt immer weiter ab, weil die Verformung beim Aufprall mit einer Überführung in thermische Energie verbunden ist. Der Erhaltungssatz ist eine Idealisierung, denn in Wirklichkeit lassen sich Energieumsetzungen durch Reibung oder Strahlung nie ganz ver­meiden. Wird das betrachtete System dadurch erweitert, dass man mit einem weiteren Term Änderung einer thermischen Energie ebenfalls berücksichtigt, so zeigt sich wiederum eine Erhaltung der Gesamtenergie.   Die Bewegungsenergie eines Körpers wird auch als kinetische Energie ( E kin ) bezeichnet, für die Höhenenergie verwendet man auch die Begriffe Lageenergie ( E L ) oder potenzielle Energie E pot .   Die mechanische Energie lässt sich durch folgende Terme beschreiben: Höhenenergie: E H = m · g · h Bewegungsenergie: E B = 1 2 m · v 2 Spannenergie: E S = 1 2 D · s 2   Bei reibungsfreien Vorgängen in einem abgeschlossenen System ist die Summe aus Höhenenergie, Bewegungsenergie und Spannenergie konstant (Energieerhaltungssatz der Mechanik).",140.0,EKV_Physik,,,18,4w0FbGp7bBZ8y5vuj0fmdH,beschreiben Hochschleudern gegenstand Hilf Federkatapult energetisch Sicht skizzieren zugehorig Energiekontenmodel,Schiffsarzt Robert Mayer notieren Tagebuch verworren Idee uber Umwandlung Bewegung warm gleichzeitig meinen neu System Physik mitbringen fachweln begegnen damal abweisend heut folgen ide erhaltungsgroßen frei Fahrt Achterbahn beginnen hoch gelegen Startpunkt Geschwindigkeit Wagen nehmen bergab bergauf ab wahrend fahrt hoch Geschwindigkeit wagen Standig fur sehen groß relativ kennzeichn Zustand wagen erst Wagen Bahn Erd zusammengehorig auffassen Physik betrachten daher Korper eindeutig Beschreibung Vorgang notig System Fallend Flummi immer schnell bei aufpral bod kurz Streck v m -- Abgebremst verformen dabei springen hoch andernd groß Geschwindigkeit hoch Verformung zeigen verschied Zustand System Ball Erd Physik Vorstellung entwickeln beobachtbaren Veranderung unveranderlich groß geben große heißen Energi Quantit aussagen uber Energi Konn gehen zwei annahmen Energi groß erfassen jeweilig Zustand System messbar hoch h fur Hohenenergi e h Geschwindigkeit v fur Bewegungsenergi e -- Verformung -- fur spannenergi System e es durfen Beschreibung energi verwendet groß wechselwirkung korpern System sprechen abgeschlossen System z -- Energi System verlasst konstant System Energi bleiben erhalten betrachten Gleiter Luftkissenbahn herabsinkend Antriebsgewicht beschleunigen Sieh Experi Bewegungsenergi Solang System Erd Luftkissenbahn Gleiter Antriebsmass weit Energieuberfuhrunge stattfind System Abgeschlosse lassen mechanisch Energi zwei ter Beschreiben hohenenergi e h m g h bewegungsenergi e b m v ter ergeben Einheit fur Energi kg m s j Joul wert Hohenenergi Hangt Festlegung Nullniveau fur hoch ab Hohenenergi Bewegungsenergi Uberfuhrt kommen Hohendifferenz Ausgang Endlag unabhangig Bezugsniveau Anderung bewegungsenergi entsprechend Differenz Quadrat Anfang Endgeschwindigkeit bestimmen entspannend fed Reibungsarm gelagert Gleiter beschleunigen Sieh Experi Spannenergi hierbei Spannenergi Bewegungsenergi Uberfuhrt Mass Geschwindigkeit Gleiter zugehorig ter hergeleiten spannenergi e -- d es ter Fur mechanisch Energi Abbildung Achterbahn Wagen Erd abschließen System betrachten Gesamtenergi konstant fur Zeitpunkt Bewegung Summ hohenenergi e h bewegungsenergi e -- wobei der Anteil laufend Konn hoch Geschwindigkeit lassen energietermen bestimmen z b Geschwindigkeit hochsten Punkt loop Ausreicht hochsten Punkt herunterzufall Durchfahre erst Betrachtung Kraft beurteilen Energiekonzept konn Kenntni Bewegungsgleichungen Beschreibung Bewegung wichtig groß bestimmen energiekonzept liefern Angabe zeitlich Ablauf durchfallen hoch h fuhren unabhangig bahnkurv sten selber Endgeschwindigkeit Lang Bewegung dauern sagen hupfenden Flummi Hohenenergi e h bewegungsenergi e -- spannenergi e -- Ineinand uberfuhren Betrag einzeln Anteil konn farbig anzeig Energiekontenmodel darstellen betrachten Flummi Boden abschließen System Ball aufpral Ausgangshoh erreichen liegen hohenenergi Reibungsfreien vorgangen gelten Energieerhaltungssatz Mechanik Gesamtenergi abgeschlossen mechanisch System Summ hohenenergi Bewegungsenergi Spannenergi konstant Reibung System Energi entziehen thermisch energi mehr vollstandig mechanisch Energi e h e b e -- umsetzbar system Reibung mehr abschließen zeigen bei Flummi Sprunghoh nehmen immer ab Verformung bei aufpral Uberfuhrung thermisch energi verbinden Erhaltungssatz Idealisierung Wirklichkeit lassen energieumsetzungen Reibung Strahlung nie ganz v meiden betrachten System dadurch erweitern weit ter Anderung thermischen Energi ebenfal berucksichtigen zeigen wiederum Erhaltung Gesamtenergi bewegungsenergi Korper Kinetisch Energi e Kin bezeichnen fur Hohenenergi verwenden Begriff Lageenergi e l Potenziel Energi e Pot mechanisch Energi lassen folgend ter Beschreiben hohenenergi e h m g h bewegungsenergi e b m v Spannenergi e -- d -- Reibungsfreien vorgangen abgeschlossen System Summ hohenenergi Bewegungsenergi Spannenergi Konstant Energieerhaltungssatz Mechanik
17812,deu,Nennen Sie die Merkmale einer harmonischen Schwingung.,"In unserer Umwelt beobachten wir häufig Vorgänge, die sich wiederholen, z.B. die Bewegung einer Schaukel oder eines Uhrpendels, eines Bungee-Springers, einer klingenden Gitarrensaite.   Gleichartige Bewegungsabläufe, bei denen sich die Richtung immer wieder umkehrt und die sich nach einer bestimmten Zeit wiederholen, heißen Schwingungen . Schwingungsfähige Systeme bezeichnet man als Oszillatoren . Die Schwingung erfolgt zwischen zwei Umkehrpunkten. Oft gibt es einen ausgezeichneten Punkt, der Gleichgewichts- oder Ruhelage heißt. Die momentane Entfernung von der Ruhelage heißt Auslenkung s oder Elongation s . Ihren Maximalwert bezeichnet man als Amplitude s M . Bei real ablaufenden Schwingungen nimmt die Amplitude in der Regel ab, die Bewegung hört nach einer gewissen Zeit auf. Es liegt eine gedämpfte Schwingung vor. Idealisiert man die Bewegung und nimmt eine konstante Amplitude an, so spricht man von einer ungedämpften Schwingung . Eine solche idealisierte Schwingung kann man sich als ständige Wiederholung eines Bewegungsabschnittes, einer Periode , vorstellen. Die dafür benötigte Zeitdauer bezeichnet man als Periodendauer T . Der Quotient f = 1 T heißt Frequenz und gibt die Anzahl der Perioden in einer Sekunde an. Zu Ehren von Heinrich Hertz (1857 – 1894) heißt die Einheit der Frequenz 1 Hertz (Hz): 1 H z = 1 s . Bewegungen die sich auf diese Weise beschreiben lassen, nennt man periodische Bewegungen . Das t - s -Diagramm der idealisierten Schwingung eines Oszillators ist eine Sinuskurve, die bei geeigneter Wahl des Koordinatensystems durch den Ursprung verläuft. Solche Bewegungen heißen harmonische Schwingungen . Ihr Graph wird durch die Gleichung s t = s M · sin ω · t beschrieben. Dabei ist s M die konstante Amplitude, ω ein Faktor mit der Einheit 1 s , sodass ω · t ein Zahlenwert ist, der als Winkel im Bogenmaß interpretiert werden kann. Dieser Winkel heißt Phase der Schwingung. Zu Beginn, d.h. für s 0 = 0 , bewegt sich der Oszillator aufwärts. Nach einer Periode passiert er mit s T = s M · sin ω · T = 0 bei der Aufwärtsbewegung erneut die Ruhelage. Also muss ω · T = 2 π sein. Die Steigung im t - s -Diagramm liefert zu jedem Zeitpunkt die Geschwindigkeit v ( t ) : v t = v M · cos ω · t Aus der Steigung dieses t - v -Graphen ergibt sich die Beschleunigung a ( t ) : a t = a M · sin ω · t Messungen zeigen, dass für die maximale Geschwindigkeit bzw. Beschleunigung gilt: v M = ω · s M und a M = ω · v M = ω 2 ⋅ s M   Schwingungen, deren t - s -Diagramm durch eine Sinuskurve beschrieben wird, heißen harmonische Schwingungen. Für sie gelten folgende Bewegungsgesetze: s t = s M · sin ω · t mit ω = 2 π T v t = v M ⋅ cos ω · t mit v M = ω · s M α t = - α M · sin ω · t mit α M = ω · v M = ω 2 · s M",140.0,EKV_Physik,,,7,7d2nAk0XyGQ7YM4Wuy6eQN,nennen merkmal harmonisch Schwingung,unser Umwelt beobachten haufig Vorgang wiederholen z -- Bewegung Schaukel Uhrpendel bunge spring klingend Gitarrensait gleichartig bewegungsablauf der Richtung immer umkehrt bestimmt Zeit wiederholen heißen schwingungen Schwingungsfahig System bezeichnen oszillator Schwingung erfolgen zwei Umkehrpunkt oft geben ausgezeichnet Punkt Gleichgewicht Ruhelag heißen momentan Entfernung Ruhelag heißen Auslenkung s elong es maximalwern bezeichnen amplitud -- m real ablaufend schwingungen nehmen amplitud Regel ab Bewegung hort gewiß Zeit liegen dampfen Schwingung idealisieren Bewegung nehmen konstant Amplitud sprechen ungedampft Schwingung Idealisiert Schwingung Standig Wiederholung Bewegungsabschnitt period vorstell dafur Benotigt Zeitdauer bezeichnen Periodendau t quotient f t heißen Frequenz geben Anzahl period Sekund Ehre heinrich Hertz heißen Einheit Frequenz Hertz Hz h z es bewegung Weis beschreiben lassen nennen periodisch Bewegung t -- diagramm idealisiert Schwingung Oszil Sinuskurv geeignet Wahl koordinatensyst Ursprung verlauft Bewegung heißen harmonisch schwingung Graph Gleichung -- t -- m sin ω t beschreiben dabei -- m konstant amplitud ω Faktor Einheit -- sodass ω t zahlenweren Winkel Bogenmaß interpretieren Winkel heißen Phase Schwingung Beginn d h fur s bewegen Oszil Aufwart Period passieren -- t s m sin ω t Aufwartsbewegung erneut Ruhelag ω t π Steigung t -- Diagramm liefern Zeitpunkt Geschwindigkeit v t v t v m co ω t Steigung t v Graphen ergeben Beschleunigung a t a t a m sin ω t Messung zeigen fur maximal Geschwindigkeit Bzw Beschleunigung gelten v m ω -- m -- m ω v m ω -- m schwingungen der t s Diagramm Sinuskurv beschreiben heißen harmonisch schwingung fur gelten folgend Bewegungsgesetz -- t s m sin ω t ω π t v t v m co ω t v m ω -- m α t α m sin ω t α m ω v m ω -- m
17819,deu,Ein Auto fährt mit einer Geschwindigkeit von 108 km h . Gib seine Geschwindigkeit in m s an.,"In Zweierreihen stehen die Rennwagen am Start. Gespannt sehen die Rennfahrer auf die Startampel. Bei Grün geht es los. Rennwagen sind sehr schnelle Autos. Man sagt auch: Sie können eine hohe Geschwindigkeit erreichen.   Die Geschwindigkeit Die Geschwindigkeit ist der Quotient aus der Strecke und der Zeit. Geschwindigkeit = Strecke Zeit v = s t Die Geschwindigkeit wird in m s (lies: Meter pro Sekunde) angegeben. Eine andere Einheit für die Geschwindigkeit kennst du von Autos. Dort wird die Einheit km/h (lies: Kilometer pro Stunde) verwendet. Wie du die Einheiten umrechnen kannst, zeigt dir die Grafik.   Auf der Rennstrecke Was passiert beim Start eines Rennens? Die Rennwagen werden beschleunigt. Die Geschwindigkeit wird größer. Dies ist eine beschleunigte Bewegung . Vor der ersten Kurve müssen die Fahrer den Rennwagen abbremsen. Die Geschwindigkeit wird kleiner. Die Rennwagen führen eine verzögerte Bewegung aus. In der Kurve verändert sich die Richtung der Bewegung. Danach folgt oft eine gerade Strecke, auf der die Fahrer den Rennwagen wieder beschleunigen. Höchstgeschwindigkeiten von über 300 km h können auf geraden Streckenabschnitten erreicht werden. Auf geraden Streckenabschnitten bleibt die Geschwindigkeit der Rennwagen gleich. Dies ist eine gleichförmige Bewegung . Die Rennstrecke zwingt die Fahrer, ständig abzubremsen und in die Kurve zu fahren. Beschleunigte Bewegungen, verzögerte Bewegungen, Kurvenfahrten und Streckenabschnitte mit gleichförmiger Bewegung wechseln auf einer Rennstrecke ständig ab.   der Streckenabschnitt der Streckenabschnitt: der Teil einer (Renn-) Strecke   Merke: Die Geschwindigkeit ist der Quotient aus der Strecke und der Zeit. Die Einheit der Geschwindigkeit ist m s oder km h . Bei einer gleichförmigen Bewegung hat ein Körper immer die gleiche Geschwindigkeit. Bei einer Kurvenfahrt ändert sich die Richtung der Bewegung. Wird ein Körper immer schneller, dann führt er eine beschleunigte Bewegung aus. Bei einer verzögerten Bewegung wird die Geschwindigkeit immer kleiner.",140.0,EKV_Physik,,,18,1snChMsOdf75V9fK5OyP0c,Auto Fahrt Geschwindigkeit km h gib Geschwindigkeit m s,zweierreih stehen rennwag Start gespannt sehen Rennfahr Startampel Grun gehen lo rennwagen schnell Auto sagen Konn hoch Geschwindigkeit erreichen Geschwindigkeit Geschwindigkeit quotient Streck Zeit Geschwindigkeit Streck Zeit v -- t Geschwindigkeit m s Lie Meter pro Sekund angegeb Einheit fur Geschwindigkeit Kennst Auto Einheit km h lie Kilomet pro Stund verwenden einheit Umrechnen Kannst zeigen Grafik Rennstreck passieren bei Start renn Rennwag beschleunigen Geschwindigkeit groß beschleunigen Bewegung erster kurv muss Fahrer rennwag Abbremse Geschwindigkeit klein rennwag Fuhr verzogert Bewegung Kurv Verandert Richtung Bewegung danach folgen oft gerad Streck fahrer rennwag beschleunig hochstgeschwindigkeiten uber km h Konn gerade streckenabschnitten erreichen gerade streckenabschnitten bleiben Geschwindigkeit rennwagen gleich gleichformig Bewegung Rennstreck zwingen fahrer Standig abzubrems kurv fahren beschleunigen Bewegung Verzogert Bewegung Kurvenfahrt Streckenabschnitt gleichformig Bewegung wechseln rennstreck Standig ab Streckenabschnitt Streckenabschnitt Teil renn Streck Merk Geschwindigkeit Quotient Streck Zeit Einheit Geschwindigkeit m s km h gleichformigen Bewegung Korper immer gleich Geschwindigkeit kurvenfahren andern Richtung Bewegung Korper immer schnell fuhrt beschleunigen Bewegung verzogert Bewegung Geschwindigkeit immer klein
17820,deu,Ein Fußgänger legt in 10 Sekunden 20 Meter zurück. Gib seine Geschwindigkeit in km/h an.,"In Zweierreihen stehen die Rennwagen am Start. Gespannt sehen die Rennfahrer auf die Startampel. Bei Grün geht es los. Rennwagen sind sehr schnelle Autos. Man sagt auch: Sie können eine hohe Geschwindigkeit erreichen.   Die Geschwindigkeit Die Geschwindigkeit ist der Quotient aus der Strecke und der Zeit. Geschwindigkeit = Strecke Zeit v = s t Die Geschwindigkeit wird in m s (lies: Meter pro Sekunde) angegeben. Eine andere Einheit für die Geschwindigkeit kennst du von Autos. Dort wird die Einheit km/h (lies: Kilometer pro Stunde) verwendet. Wie du die Einheiten umrechnen kannst, zeigt dir die Grafik.   Auf der Rennstrecke Was passiert beim Start eines Rennens? Die Rennwagen werden beschleunigt. Die Geschwindigkeit wird größer. Dies ist eine beschleunigte Bewegung . Vor der ersten Kurve müssen die Fahrer den Rennwagen abbremsen. Die Geschwindigkeit wird kleiner. Die Rennwagen führen eine verzögerte Bewegung aus. In der Kurve verändert sich die Richtung der Bewegung. Danach folgt oft eine gerade Strecke, auf der die Fahrer den Rennwagen wieder beschleunigen. Höchstgeschwindigkeiten von über 300 km h können auf geraden Streckenabschnitten erreicht werden. Auf geraden Streckenabschnitten bleibt die Geschwindigkeit der Rennwagen gleich. Dies ist eine gleichförmige Bewegung . Die Rennstrecke zwingt die Fahrer, ständig abzubremsen und in die Kurve zu fahren. Beschleunigte Bewegungen, verzögerte Bewegungen, Kurvenfahrten und Streckenabschnitte mit gleichförmiger Bewegung wechseln auf einer Rennstrecke ständig ab.   der Streckenabschnitt der Streckenabschnitt: der Teil einer (Renn-) Strecke   Merke: Die Geschwindigkeit ist der Quotient aus der Strecke und der Zeit. Die Einheit der Geschwindigkeit ist m s oder km h . Bei einer gleichförmigen Bewegung hat ein Körper immer die gleiche Geschwindigkeit. Bei einer Kurvenfahrt ändert sich die Richtung der Bewegung. Wird ein Körper immer schneller, dann führt er eine beschleunigte Bewegung aus. Bei einer verzögerten Bewegung wird die Geschwindigkeit immer kleiner.",140.0,EKV_Physik,,,15,58tvgazbfjS6jEbUz8kFPP,Fußgang legen sekund Meter zuruck gib Geschwindigkeit km h,zweierreih stehen rennwag Start gespannt sehen Rennfahr Startampel Grun gehen lo rennwagen schnell Auto sagen Konn hoch Geschwindigkeit erreichen Geschwindigkeit Geschwindigkeit quotient Streck Zeit Geschwindigkeit Streck Zeit v -- t Geschwindigkeit m s Lie Meter pro Sekund angegeb Einheit fur Geschwindigkeit Kennst Auto Einheit km h lie Kilomet pro Stund verwenden einheit Umrechnen Kannst zeigen Grafik Rennstreck passieren bei Start renn Rennwag beschleunigen Geschwindigkeit groß beschleunigen Bewegung erster kurv muss Fahrer rennwag Abbremse Geschwindigkeit klein rennwag Fuhr verzogert Bewegung Kurv Verandert Richtung Bewegung danach folgen oft gerad Streck fahrer rennwag beschleunig hochstgeschwindigkeiten uber km h Konn gerade streckenabschnitten erreichen gerade streckenabschnitten bleiben Geschwindigkeit rennwagen gleich gleichformig Bewegung Rennstreck zwingen fahrer Standig abzubrems kurv fahren beschleunigen Bewegung Verzogert Bewegung Kurvenfahrt Streckenabschnitt gleichformig Bewegung wechseln rennstreck Standig ab Streckenabschnitt Streckenabschnitt Teil renn Streck Merk Geschwindigkeit Quotient Streck Zeit Einheit Geschwindigkeit m s km h gleichformigen Bewegung Korper immer gleich Geschwindigkeit kurvenfahren andern Richtung Bewegung Korper immer schnell fuhrt beschleunigen Bewegung verzogert Bewegung Geschwindigkeit immer klein
