language,description,context,tenant_id,tenant_name,topic_name,topic_description,word_count,taskId
17659,deu,Lochblenden und Sammellinsen erzeugen Bilder leuchtender Gegenstände. Nenne Gemeinsamkeiten und Unterschiede der Bilder. Erkläre sie mit der unterschiedlichen Bildentstehung.,"Mit dieser Sammellinse werden zwei Bilder vom Fenster, das sich hinter dem Betrachter befindet, erzeugt. Eines davon wird auf der Wand aufgefangen. Nur in einem bestimmten Abstand der Linse von der Wand ist dieses Bild scharf. Wodurch unterscheidet sich die Abbildung an der Wand von dem Bild, das man auf der Linse sieht?   Das Bild des Fensters auf der Wand ist seitenverkehrt und steht auf dem Kopf, während das Spiegelbild auf der Linse aufrecht steht. Das Bild des Fensters an der Wand ist kleiner als das Fenster selbst. Die Abbildung zeigt, wie das umgedrehte Bild entsteht. Licht, das von der Spitze der Kerzenflamme ausgeht und auf die Linse trifft, wird durch die Linse so gebrochen, dass es hinter der Linse nach unten zusammengeführt wird. Licht, das vom Docht ausgeht, wird durch die Linse nach oben gebrochen und zusammengeführt. Alle diese Bildpunkte entstehen nur in einem bestimmten Abstand hinter der Linse. Die Abstände von Bild und Gegenstand zur Linsenmitte (Bildweite und Gegenstandsweite) müssen zueinander passen, sonst ist das Bild unscharf. Die Bildgröße hängt von der Gegenstandsweite ab. In der Abbildung ist sie gerade so groß, dass Kerze und Bild der Kerze gleich groß sind. Das Bild der Kerze existiert auch ohne Schirm! Entfernt man den Schirm und blickt von hinten in Richtung Linse, so sieht man das Bild im Raum schweben: An der Stelle, wo der Schirm vorher war. Staub oder Nebel an dieser Stelle lassen das Bild besser erkennen. Auch mit einer wassergefüllten Glaskugel kann ein Bild erzeugt werden. Die Wasserkugel wird zur Linse, wenn wir sie uns in einen Würfel und zwei Kugelkappen zerlegt denken. Die Flächen des Würfels verschieben Lichtstrahlen beim Durchgang nur wie eine dicke Glasplatte. Die beiden gekrümmten Oberflächen der Kugelkappen wirken wie eine Sammellinse.   Mit dem dargestellten Versuchsaufbau lässt sich herausfinden, welchen Abstand Lichtquelle, Linse und Schirm zueinander haben müssen, damit das Bild scharf ist. Zur Beschreibung der Abstände werden zwei Begriffe benötigt: Der Abstand von der Linse zum Schirm heißt Bildweite b , der Abstand vom Gegenstand zur Linse heißt Gegenstandsweite g . Die Kerze soll aus einer sehr großen Gegenstandsweite immer näher zur Linse geschoben werden. Dabei wird jeweils die Bildweite so verändert, dass ein scharfes Bild auf dem Schirm entsteht. Zunächst stellt man fest, dass dies für jede Gegenstandsweite höchstens bei einer einzigen Bildweite gelingt, d. h., um ein scharfes Bild zu erhalten, muss zu jeder Gegenstandsweite eine ganz bestimmte Bildweite eingestellt werden. Bei sehr großer Gegenstandsweite verändert sich die Schärfe des Bildes zunächst allerdings kaum, wenn eine etwas zu große oder zu kleine Bildweite eingestellt wird. Je kleiner die Gegenstandsweite wird, desto genauer muss man die Bildweite einstellen, um eine scharfes Bild zu erhalten. Das scharfe Bild steht in allen Fällen auf dem Kopf und es wird größer, wenn die Gegenstandsweite abnimmt. Ist die Gegenstandsweite sehr klein, entsteht gar kein Bild auf dem Schirm. Bei genauer Untersuchung lassen sich mehrere Fälle unterscheiden: g > 2 f , d.h., die Gegenstandsweite ist größer als die doppelte Brennweite der Sammellinse: Das Bild ist kleiner als das Original. g = 2 f , d.h., die Gegenstandsweite ist gleich der doppelten Brennweite: Das Bild ist so groß wie das Original und die Bildweite ist gleich der doppelten Brennweite ( b = 2 f ). f < g < 2 f , d.h., die Gegenstandsweite liegt zwischen der einfachen und doppelten Brennweite: Das Bild ist größer als das Original und die Bildweite ist größer als die doppelte Brennweite ( b > 2 f ). g ≤ f , d.h., die Gegenstandsweite ist gleich der Brennweite oder kleiner als die Brennweite: Auf dem Schirm entsteht kein Bild .",140.0,EKV_Physik,,,19,E7x6BYONFk8s9yhgeTguo
17660,deu,"Erkläre mithilfe des Teilchenmodells, was der absolute Nullpunkt ist.","Wärme verändert die Temperatur Wärme wird zugeführt oder abgegeben. Wenn einem Körper Wärme zugeführt wird, dann steigt seine Temperatur . Wenn ein Körper Wärme abgibt, dann sinkt seine Temperatur. Die Temperatur eines Körpers wird mit einem Thermometer gemessen. Ein Thermometer zeigt uns Temperaturen aber keine Wärme an. In Bild steigt die Temperatur der kalten Hände, weil die Heizung Wärme an die Hände abgibt. Wenn die Jugendlicheim Bild im Winter ins Freie geht und keine Handschuhe trägt, dann geben die Hände Wärme ab. Die Hände werden kalt.   Wärme und Temperatur sind nicht das Gleiche Die Grafik zeigt zwei Wannen mit Wasser. In einer Wanne befindet sich 1 Liter Wasser, in der anderen sind 2 Liter. Beide Wassermengen haben eine Temperatur von 20 ° C und sollen auf 50 ° C erwärmt werden. Die Anfangstemperatur und die Endtemperatur beider Wassermengen sind gleich. Die Wärme, die dafür zugeführt werden muss, ist aber unterschiedlich groß. Bei den 2 Litern Wasser muss mehr Wärme zugeführt werden als bei 1 Liter, um die gleiche Temperatur von 50 ° C zu erreichen. Dieses Beispiel zeigt, dass man zwischen Wärme und Temperatur unterscheiden muss.   Die Brown’sche Bewegung Im Jahre 1827 untersuchte der schottische Botaniker Robert Brown (1773 – 1858) Pollenstaub im Wasser. Im Mikroskop beobachtete er, dass sich der Pollenstaub im Wasser ständig bewegt. Diese Bewegung wurde nach ihm Brown’sche Bewegung genannt. Woher kommt aber diese Bewegung?   der Botaniker der Botaniker: Experte für Pflanzen   der Pollenstaub der Pollenstaub: leichter, flugfähiger, männlicher Samen einer Blüte   Teilchenbewegung Die Brown’sche Bewegung kann mit dem Teilchenmodell erklärt werden: Die Wasserteilchen stoßen ständig gegen die Pollenteilchen und setzen diese in Bewegung.   Temperatur und Telchenbewegung Die Teilchenbewegung hängt mit der Temperatur eines Körpers zusammen: Wenn sich die Temperatur eines Körpers erhöht, dann bewegen sich die Teilchen schneller.   Thermische Energie Die Energie, die in der Bewegung der Teilchen gespeichert ist, wird thermische Energie genannt. Je schneller sich die Teilchen bewegen, desto höher ist die Temperatur und desto höher ist die thermische Energie. Bewegen sich die Teilchen nur langsam, dann hat ein Körper eine niedrigere Temperatur und eine geringere thermische Energie.   Der absolute Nullpunkt Wenn man einen Körper immer weiter abkühlt, dann nimmt die Bewegung seiner Teilchen immer weiter ab. Irgendwann ist es so kalt, dass sich die Teilchen nicht mehr bewegen können. Dann ist die niedrigste Temperatur erreicht, die überhaupt möglich ist. Diese niedrigste Temperatur bezeichnet man als absoluten Nullpunkt . Er liegt bei - 273 , 15 ° C . Den absoluten Nullpunkt wählte Lord Kelvin als Nullpunkt für seine Temperatur-Skala, die Kelvin-Skala ( 0 K = - 273 , 15 ° C ) .   absolut absolut: vollständig, total   Merke: Das Thermometer zeigt Temperaturen an. Wärme wird zugeführt oder abgegeben und verändert damit die Temperatur. Je stärker sich die Teilchen im Inneren eines Körpers bewegen, desto höher ist die Temperatur und die innere Energie des Körpers.",140.0,EKV_Physik,,,9,2luJcWBnasA8r9oewh90fi
17661,deu,Nenne die wesentlichen Bestandteile des Wärmekraftwerks.,"Wie ein Wärmekraftwerk funktioniert Ein Wärmekraftwerk sieht kompliziert aus. Kühltürme, Schornsteine und viele andere Gebäude sind über ein großes Gelände verteilt. Doch schon ein einfacher Versuch verdeutlicht, wie ein Wärmekraftwerk funktioniert. In einem Teekessel wird Wasser erwärmt, bis es siedet. Das Wasser wird zu Dampf und treibt ein kleines Turbinenrad an. Verbindet man nun das Turbinenrad mit einem Dynamo, dann dreht er sich und erzeugt elektrische Energie. Die Abläufe des Modellversuchs findest du auch in Wärmekraftwerken. In Wärmekraftwerken wird chemische Energie, die z. B. in Kohle, Erdöl oder Erdgas gespeichert ist, durch Verbrennung zunächst in Wärme und dann in elektrische Energie umgewandelt. Die Grafik zeigt, wie ein Kohlekraftwerk funktioniert.   Energieentwertung Die Umwandlung von Wärme in elektrische Energie gelingt in keinem Wärmekraftwerk vollständig. Bei jeder Energieumwandlung wird auch Wärme frei, die nicht genutzt werden kann. Diese Energie ist entwertet (verleiche die Grafik unten). In modernen Wärmekraftwerken werden rund 40% der eingesetzten chemischen Energie in elektrische Energie umgewandelt. Die restlichen rund 60% sind entwertet.   Kohlekraftwerke Braunkohlekraftwerke und Steinkohlekraftwerke decken etwa die Hälfte des Bedarfs an elektrischer Energie in Deutschland ab. Ein einziges Kraftwerk erzeugt eine elektrische Leistung von 2700 M W . Das reicht aus, um zwei Großstädte mit Strom zu versorgen. Pro Tag werden in einem solchen Kraftwerk rund 70 000 t Braunkohle verbrannt. Das entspricht rund 2000 Lastwagen-Ladungen.   Verstärkung des Treibhauseffekts Bei der Verbrennung von Kohle, Erdöl und Erdgas entstehen große Mengen an Schadstoffen, z. B. Kohlenstoffdioxid, Schwefeldioxid, Stickstoffoxide oder Aschenstaub. Einige Schadstoffe können durch aufwendige Filteranlagen verringert werden. Es gelangen aber trotzdem noch viele Schadstoffe ungehindert in unsere Atmosphäre. Diese Schadstoffe verstärken den Treibhauseffekt.   Merke: In Wärmekraftwerken wird aus chemischer Energie elektrische Energie erzeugt. Bei der Umwandlung wird Energie entwertet und es entstehen Schadstoffe, die den Treibhauseffekt verstärken.",140.0,EKV_Physik,,,6,8gvIOhnGwyy7QUFOFsOLTX
17662,deu,"Jana sagt: „Wegen des Wirkungsgrads ist es unsinnig, mit Strom aus Gaskraftwerken zu heizen.“ Beurteile ihre Aussage.","Wie ein Wärmekraftwerk funktioniert Ein Wärmekraftwerk sieht kompliziert aus. Kühltürme, Schornsteine und viele andere Gebäude sind über ein großes Gelände verteilt. Doch schon ein einfacher Versuch verdeutlicht, wie ein Wärmekraftwerk funktioniert. In einem Teekessel wird Wasser erwärmt, bis es siedet. Das Wasser wird zu Dampf und treibt ein kleines Turbinenrad an. Verbindet man nun das Turbinenrad mit einem Dynamo, dann dreht er sich und erzeugt elektrische Energie. Die Abläufe des Modellversuchs findest du auch in Wärmekraftwerken. In Wärmekraftwerken wird chemische Energie, die z. B. in Kohle, Erdöl oder Erdgas gespeichert ist, durch Verbrennung zunächst in Wärme und dann in elektrische Energie umgewandelt. Die Grafik zeigt, wie ein Kohlekraftwerk funktioniert.   Energieentwertung Die Umwandlung von Wärme in elektrische Energie gelingt in keinem Wärmekraftwerk vollständig. Bei jeder Energieumwandlung wird auch Wärme frei, die nicht genutzt werden kann. Diese Energie ist entwertet (verleiche die Grafik unten). In modernen Wärmekraftwerken werden rund 40% der eingesetzten chemischen Energie in elektrische Energie umgewandelt. Die restlichen rund 60% sind entwertet.   Kohlekraftwerke Braunkohlekraftwerke und Steinkohlekraftwerke decken etwa die Hälfte des Bedarfs an elektrischer Energie in Deutschland ab. Ein einziges Kraftwerk erzeugt eine elektrische Leistung von 2700 M W . Das reicht aus, um zwei Großstädte mit Strom zu versorgen. Pro Tag werden in einem solchen Kraftwerk rund 70 000 t Braunkohle verbrannt. Das entspricht rund 2000 Lastwagen-Ladungen.   Verstärkung des Treibhauseffekts Bei der Verbrennung von Kohle, Erdöl und Erdgas entstehen große Mengen an Schadstoffen, z. B. Kohlenstoffdioxid, Schwefeldioxid, Stickstoffoxide oder Aschenstaub. Einige Schadstoffe können durch aufwendige Filteranlagen verringert werden. Es gelangen aber trotzdem noch viele Schadstoffe ungehindert in unsere Atmosphäre. Diese Schadstoffe verstärken den Treibhauseffekt.   Merke: In Wärmekraftwerken wird aus chemischer Energie elektrische Energie erzeugt. Bei der Umwandlung wird Energie entwertet und es entstehen Schadstoffe, die den Treibhauseffekt verstärken.",140.0,EKV_Physik,,,17,CFpM7sFBcW77UqbTwzJNq
17663,deu,"Lies das Material. Begründe, bei welchen Personen eine eindeutige Kaufempfehlung schwierig ist.","Material: Rätsel: Welches Auto passt zu wem? Auto A (Benzinmotor) Auto B (Dieselmotor) Auto C (Elektromotor) Auto D (Hybrid) 24000 € 26500 € 36000 € 38000 € 9 , 80 € / 100 km (innerorts) 6 , 10 € / 100 km (innerorts) 4 , 20 € / 100 km (innerorts) 3 , 80 € / 100 km (innerorts) 6 , 30 € / 100 km (außerorts) 4 , 80 € / 100 km (außerorts) 6 , 10 € / 100 km (außerorts) 5 , 80 € / 100 km (außerorts) Ich lebe auf dem Land und fahre täglich mit meinem Auto mehrere Kilometer zur Arbeit. Katrin Berger Ich will für mein Auto möglichst wenig bezahlen. Clemens Maier Ich fahre kurze Strecken. Gelegentlich besuche ich meine weiter entfernt wohnenden Enkelkinder. Manfred Zink Ich möchte keine Schadstoffe mit meinem Auto ausstoßen. Lisa Huth",140.0,EKV_Physik,,,12,7mZ3txR9OHZ6DyrNlvwJEo
17664,deu,Vervollständige die folgenden Sätze:   Bei einer losen Rolle ist die Zugkraft halb so groß wie…,"Lasten bewegen Schwere Lasten kannst du mithilfe von Seilen und Rollen bewegen. Das Seil läuft dabei über eine Rolle. In den folgenden Grafiken siehst du, wie die Menschen früher schwere Lasten auf verschiedene Arten in die oberen Stockwerke ihres Hauses transportierten. Auch heute werden Lasten mithilfe von Rollen und Seilen hochgehoben und bewegt.   Die feste Rolle Die Last ist an einem Seilende befestigt. Das Seil läuft über eine Rolle, die an einem Balken befestigt ist. Diese Rolle wird feste Rolle genannt. Der Arbeiter zieht das Seil nach unten. Dadurch wird die Last nach oben angehoben. Die notwendige Zugkraft ist dabei genauso groß wie die Gewichtskraft der Last. Wird die Last um 2 m angehoben, muss der Arbeiter 2 m am Seil ziehen. Dazu sagt man: Kraftweg und Lastweg sind gleich groß. Eine feste Rolle ändert also nur die Richtung der Kraft.   Last Gewicht, Gegenstand, …   Die lose Rolle Die Rolle ist an der Last angebracht. Das Seil läuft über eine Rolle und es ist oben am Haus an einem Balken befestigt. Der Arbeiter steht auf dem Balkon. Er zieht mit dem Seil die Rolle mit der Last nach oben auf den Balkon. Diese Rolle wird lose Rolle genannt, weil sie sich zusammen mit der Last bewegt. Dabei ist die Zugkraft, die man zum Heben der Last anwenden muss, halb so groß wie die Gewichtskraft. Beträgt die Gewichtskraft z. B. 100 N , dann beträgt die Zugkraft 50 N . Mit einer losen Rolle kann also Kraft gespart werden. Dafür ist der Kraftweg aber doppelt so lang. Soll die Last z. B. 2 m angehoben werden, dann muss man das Seil 4 m weit bewegen.   Merke: Bei der festen Rolle wird die Richtung der Kraft verändert. Die Zugkraft ist genau so groß wie die Gewichtskraft. Bei einer losen Rolle ist die Zugkraft halb so groß wie die Gewichtskraft der Last. Der Kraftweg ist dafür doppelt so groß wie der Lastweg.",140.0,EKV_Physik,,,15,9P26xAYayNU5TKdz69oxLu
17666,deu,"Nenne Werkzeuge und Geräte, bei denen es Hebel gibt.","Die Wippe ist ein Hebel Fast auf jedem Spielplatz befindet sich eine Wippe. Kinder sitzen an je einem Ende der Wippe und können miteinander schaukeln. Physikalisch betrachtet ist eine Wippe ein Hebel . Jeder Hebel hat einen Drehpunkt . Alle Griffe oder Stangen, die drehbar gelagert sind, bezeichnet man als Hebel. Bei der Wippe gibt es links und rechts vom Drehpunkt einen Hebelarm . Die Wippe bezeichnet man deshalb als zweiseitigen Hebel .   Der Hebel als Kraftwandler Auf einer Wippe hast du bestimmt schon beobachtet, dass ein kleines Mädchen einen großen Jungen anheben kann. Wie funktioniert das? Mit ihrem Gewicht üben die Kinder auf der Wippe eine Kraft nach unten aus. Das kleinere und leichtere Mädchen übt mit ihrem Körpergewicht weniger Kraft aus als der große Junge. Sie sitzt aber weiter vom Drehpunkt weg. Deshalb kann das Mädchen den großen Jungen anheben. Hebel können also Kräfte verändern. Man sagt deshalb auch: Hebel sind Kraftwandler . Am Beispiel des kleinen Mädchens erkennst du: Mit einem Hebel kann Kraft gespart werden. Je länger ein Hebelarm wird, desto kleiner wird der Kraftaufwand .   Kraftaufwand der Kraftaufwand: die Kraft, die benötigt wird   Eine harte Nuss ist zu knacken Willst du eine Nuss zerdrücken, reicht deine Muskelkraft alleine nicht aus. Du brauchst ein geeignetes Werkzeug dazu. Am besten eignet sich ein Nussknacker mit langem Griff. Beim Nussknacker befindet sich der Drehpunkt ganz am Ende des Hebels. Es gibt einen kurzen und einen langen Hebelarm beim Nussknacker. Den langen Hebelarm nutzt du zum Zudrücken.   Der einseitige Hebel Befinden sich die beiden Hebelarme auf derselben Seite vom Drehpunkt, so spricht man von einem einseitigen Hebel . Beispiele für einen einseitigen Hebel sind der Nussknacker und die Schubkarre:   Anwendung von Hebeln Bei vielen Werkzeugen wird die Kraftwandlung von Hebeln ausgenutzt. Die Astschere und der Schraubenschlüssel sind Beispiele für Werkzeuge mit Hebeln. Durch eine Verlängerung des Griffs wird der Kraftaufwand für den Handwerker kleiner.   Merke: Ein Hebel besteht aus einem Drehpunkt und zwei Hebelarmen. Es gibt einseitige und zweiseitige Hebel. Mit einem Hebel kann Kraft gespart werden. Je länger ein Hebelarm wird, desto kleiner wird der Kraftaufwand.",140.0,EKV_Physik,,,9,1O6WcWbXDPK6MAWpHY8DkO
17667,deu,Nenne die Bestandteile eines Hebels.,"Die Wippe ist ein Hebel Fast auf jedem Spielplatz befindet sich eine Wippe. Kinder sitzen an je einem Ende der Wippe und können miteinander schaukeln. Physikalisch betrachtet ist eine Wippe ein Hebel . Jeder Hebel hat einen Drehpunkt . Alle Griffe oder Stangen, die drehbar gelagert sind, bezeichnet man als Hebel. Bei der Wippe gibt es links und rechts vom Drehpunkt einen Hebelarm . Die Wippe bezeichnet man deshalb als zweiseitigen Hebel .   Der Hebel als Kraftwandler Auf einer Wippe hast du bestimmt schon beobachtet, dass ein kleines Mädchen einen großen Jungen anheben kann. Wie funktioniert das? Mit ihrem Gewicht üben die Kinder auf der Wippe eine Kraft nach unten aus. Das kleinere und leichtere Mädchen übt mit ihrem Körpergewicht weniger Kraft aus als der große Junge. Sie sitzt aber weiter vom Drehpunkt weg. Deshalb kann das Mädchen den großen Jungen anheben. Hebel können also Kräfte verändern. Man sagt deshalb auch: Hebel sind Kraftwandler . Am Beispiel des kleinen Mädchens erkennst du: Mit einem Hebel kann Kraft gespart werden. Je länger ein Hebelarm wird, desto kleiner wird der Kraftaufwand .   Kraftaufwand der Kraftaufwand: die Kraft, die benötigt wird   Eine harte Nuss ist zu knacken Willst du eine Nuss zerdrücken, reicht deine Muskelkraft alleine nicht aus. Du brauchst ein geeignetes Werkzeug dazu. Am besten eignet sich ein Nussknacker mit langem Griff. Beim Nussknacker befindet sich der Drehpunkt ganz am Ende des Hebels. Es gibt einen kurzen und einen langen Hebelarm beim Nussknacker. Den langen Hebelarm nutzt du zum Zudrücken.   Der einseitige Hebel Befinden sich die beiden Hebelarme auf derselben Seite vom Drehpunkt, so spricht man von einem einseitigen Hebel . Beispiele für einen einseitigen Hebel sind der Nussknacker und die Schubkarre:   Anwendung von Hebeln Bei vielen Werkzeugen wird die Kraftwandlung von Hebeln ausgenutzt. Die Astschere und der Schraubenschlüssel sind Beispiele für Werkzeuge mit Hebeln. Durch eine Verlängerung des Griffs wird der Kraftaufwand für den Handwerker kleiner.   Merke: Ein Hebel besteht aus einem Drehpunkt und zwei Hebelarmen. Es gibt einseitige und zweiseitige Hebel. Mit einem Hebel kann Kraft gespart werden. Je länger ein Hebelarm wird, desto kleiner wird der Kraftaufwand.",140.0,EKV_Physik,,,5,2U6hRpolI4D7j1nzJMeWRZ
17668,deu,"Astschere, Schubkarre, Nussknacker und Schraubenschlüssel sind Beispiele für Hebel. Handelt es sich jeweils um einen einseitigen oder zweiseitigen Hebel? Begründe deine Entscheidung.","Die Wippe ist ein Hebel Fast auf jedem Spielplatz befindet sich eine Wippe. Kinder sitzen an je einem Ende der Wippe und können miteinander schaukeln. Physikalisch betrachtet ist eine Wippe ein Hebel . Jeder Hebel hat einen Drehpunkt . Alle Griffe oder Stangen, die drehbar gelagert sind, bezeichnet man als Hebel. Bei der Wippe gibt es links und rechts vom Drehpunkt einen Hebelarm . Die Wippe bezeichnet man deshalb als zweiseitigen Hebel .   Der Hebel als Kraftwandler Auf einer Wippe hast du bestimmt schon beobachtet, dass ein kleines Mädchen einen großen Jungen anheben kann. Wie funktioniert das? Mit ihrem Gewicht üben die Kinder auf der Wippe eine Kraft nach unten aus. Das kleinere und leichtere Mädchen übt mit ihrem Körpergewicht weniger Kraft aus als der große Junge. Sie sitzt aber weiter vom Drehpunkt weg. Deshalb kann das Mädchen den großen Jungen anheben. Hebel können also Kräfte verändern. Man sagt deshalb auch: Hebel sind Kraftwandler . Am Beispiel des kleinen Mädchens erkennst du: Mit einem Hebel kann Kraft gespart werden. Je länger ein Hebelarm wird, desto kleiner wird der Kraftaufwand .   Kraftaufwand der Kraftaufwand: die Kraft, die benötigt wird   Eine harte Nuss ist zu knacken Willst du eine Nuss zerdrücken, reicht deine Muskelkraft alleine nicht aus. Du brauchst ein geeignetes Werkzeug dazu. Am besten eignet sich ein Nussknacker mit langem Griff. Beim Nussknacker befindet sich der Drehpunkt ganz am Ende des Hebels. Es gibt einen kurzen und einen langen Hebelarm beim Nussknacker. Den langen Hebelarm nutzt du zum Zudrücken.   Der einseitige Hebel Befinden sich die beiden Hebelarme auf derselben Seite vom Drehpunkt, so spricht man von einem einseitigen Hebel . Beispiele für einen einseitigen Hebel sind der Nussknacker und die Schubkarre:   Anwendung von Hebeln Bei vielen Werkzeugen wird die Kraftwandlung von Hebeln ausgenutzt. Die Astschere und der Schraubenschlüssel sind Beispiele für Werkzeuge mit Hebeln. Durch eine Verlängerung des Griffs wird der Kraftaufwand für den Handwerker kleiner.   Merke: Ein Hebel besteht aus einem Drehpunkt und zwei Hebelarmen. Es gibt einseitige und zweiseitige Hebel. Mit einem Hebel kann Kraft gespart werden. Je länger ein Hebelarm wird, desto kleiner wird der Kraftaufwand.",140.0,EKV_Physik,,,22,2ov2eE4EhpP9Pqq40AzeRR
17669,deu,"Beurteile, ob es sich beim Nachdenken um Arbeit im physikalischen Sinn handelt.","Was ist mechanische Arbeit? Wenn du eine Klassenarbeit schreibst, Hausaufgaben erledigst oder den Rasen mähst, dann bezeichnest du diese Tätigkeiten als Arbeit. Im Alltag verbinden wir mit dem Wort Arbeit sehr viele verschiedene Tätigkeiten. Im Gegensatz zum Alltag spricht man in der Physik aber nur dann von Arbeit, wenn bestimmte Bedingungen erfüllt sind. Wenn auf einen Körper eine Kraft ausgeübt wird und der Körper sich dadurch in Richtung der Kraft bewegt, dann sagt der Physiker, dass mechanische Arbeit verrichtet wird. Auf dem Foto siehst du, dass viele Menschen ein Flugzeug ziehen. Das Flugzeug bewegt sich, weil die Männer eine Kraft ausüben. Das Flugzeug bewegt sich in Richtung der Kraft. Damit sind beide Bedingungen für mechanische Arbeit erfüllt. Du verrichtest aber keine mechanische Arbeit, wenn du eine Kiste mit Wasserflaschen hältst. Warum ist das so? Um die Flaschen zu halten, musst du eine Kraft nach oben aufwenden. Die Flaschen bewegen sich aber nicht nach oben. Die Flaschen bewegen sich also nicht in die Richtung der Kraft. Deshalb wird keine mechanische Arbeit verrichtet.   Die Berechnung der Arbeit Für die Berechnung der mechanischen Arbeit benötigst du die Kraft und den Weg. Du kannst die mechanische Arbeit berechnen, indem du die Kraft F mit dem zurückgelegten Weg s multiplizierst. Die Arbeit hat das Formelzeichen W . Arbeit = Kraft · Weg W = F · s   Die Einheit der Arbeit Die Einheit der Kraft ist das Newton und die Einheit des Wegs ist das Meter. Die Einheit der Arbeit ist daher das Produkt aus diesen beiden Einheiten: das Newtonmeter ( Nm ). Statt der Einheit Newtonmeter wird auch die Einheit Joule ( J ) verwendet. Sie wurde nach dem englischen Physiker James Prescott Joule (1818 – 1889) benannt. 1 Newtonmeter = 1 Joule 1 Nm = 1 J   Hubarbeit In der Grafik hebt der Junge ein Zeitungsbündel in den Kofferraum. Er muss eine Kraft aufwenden, um die Zeitungen hochzuheben. Diese Kraft wird Hubkraft F H genannt. Die Hubkraft ist genauso groß wie die Gewichtskraft des Zeitungsbündels.   Berechnung der Hubarbeit Die Größe der Hubarbeit W H hängt von der Hubkraft und der zurückgelegten Höhe ab. Hubarbeit = Hubkraft · Höhe W H = F H ⋅ s   Merke: Wenn auf einen Körper eine Kraft ausgeübt wird und er sich in Richtung der Kraft bewegt, dann wird mechanische Arbeit verrichtet. Formelzeichen der Arbeit: W Berechnung der Arbeit: Arbeit = Kraft · Weg W = F · s Einheit der Arbeit: Newtonmeter ( Nm ) oder Joule ( J ) 1 Nm = 1 J",140.0,EKV_Physik,,,12,1aVkMEsOura5CfmFZ8Kjie
