language,description,context,tenant_id,tenant_name,topic_name,topic_description,word_count,taskId
16662,deu,"Das Riemann-Modell (1970), das später von Thomann weiterentwickelt wurde, zeigt jeweils zwei Grundstrebungen, die in einem Spannungsverhältnis zueinander stehen. Eines ist Dauer versus Wechsel. Wie heisst das andere?",,11.0,connectsolutions_de,DE_L_LT,,28,618JS178V4m5WzQfFNAgzt
16663,deu,Es gibt in der Regel vier Gründe für die Einberufung einer Sitzung. Welche?,,11.0,connectsolutions_de,DE_L_LT,,13,3eDkbOKjfNz9xGENZE58q7
16664,deu,Was sind die vier Schlüsselelemente des Management by Objectives (MbO)?,,11.0,connectsolutions_de,DE_L_LT,,10,889XPjuhrMC8igSsef7uH4
16666,deu,Was können Anzeichen von Demotivation sein?,,11.0,connectsolutions_de,DE_L_LT,,6,9n4PeJDa3Lb9MSzajchbf4
16667,deu,Übersetze den folgenden Satz.Funktioniert das jetzt wieder?,,8.0,demo,,,7,qagnuZTmWR9J880gr37hv
16668,deu,Bitte übersetze den folgenden Satz in Englisch.Ich schreibe ein Buch.,,8.0,demo,,,10,43a1e1TyRjY8RhYoQDib9g
16674,deu,"Forme den markierten Nebensatz in einen Hauptsatz um. (Den nicht markierten Satz belässt du in seiner Form. Du musst allenfalls die Reihenfolge der Teilsätze umstellen).Weil starker Regen fiel, wurde das Spiel abgesagt.",,1.0,Lernnavi,Haupt- und Nebensätze,,32,2257S80gxTw9nQLU6rgfx6
16675,deu,"Forme den markierten Nebensatz in einen Hauptsatz um. (Den nicht markierten Satz belässt du in seiner Form. Du musst allenfalls die Reihenfolge der Teilsätze umstellen).Am Meer ist es herrlich, weshalb viele Leute gern dorthin in die Ferien fahren.",,1.0,Lernnavi,Haupt- und Nebensätze,,38,aAR4a8DVqZm8Gd4XNz107K
16676,deu,Bitte übersetze den folgenden Satz auf Englisch.Es ist ein wunderschöner Tag heute.,,8.0,demo,,,12,7IPKJG1ojiVafqQqZ4GEuG
16703,deu,"Bitte geben Sie die Antwort mithilfe von Stichwörtern an:Die meisten Veränderungsprojekte haben Auswirkungen auf 2 Ebenen, welche sind das Ihrer Meinung nach?",,11.0,connectsolutions_de,6. Die Veränderungsprozesse in den Wechselwirkungen beschreiben,,22,5Bi8jM84BXgazkzKtwi5YC
16704,deu,"Wie nennt man die wiederholte Berichterstattung über Leistungen, die dank der Veränderung erzielt wurden?",,11.0,connectsolutions_de,4. Die Veränderungsbereitschaft beurteilen,,14,5le7xcGiiTM885JgrxpyvR
16705,deu,"Bitte geben Sie Ihre Antwort mithilfe von Stichwörtern an:Was ist Ihrer Meinung nach eine Eigenschaft, die einer Führungskraft helfen kann, mit der eigenen Sensibilität umzugehen?",,11.0,connectsolutions_de,4. Die Veränderungsbereitschaft beurteilen,,25,6khnaJSYzSK79MOfjlEf1a
16706,deu,"Nennen Sie ein Beispiel für einen technologischen Wandel, der den Bereich der Arbeitsmittel betrifft.",,11.0,connectsolutions_de,1. Veränderung auf der Basis der Umwelt abschätzen,,14,339yUwCWvS780PvmbGpNPP
16707,deu,"Nennen Sie ein Beispiel für einen organisatorischen Wandel, der das Organisationsmodell betrifft.",,11.0,connectsolutions_de,3. Gezielte Massnahmen ableiten,,12,3TBB0fx7hgJ6mnYa4sYqdg
16708,deu,Geben Sie Ihre Antwort mithilfe einer Beschreibung an:Welche Erwartungen werden an die Führungsrolle gestellt?,,11.0,connectsolutions_de,6. Die Veränderungsprozesse in den Wechselwirkungen beschreiben,,14,87INKpsHQ16aWoWRLBZQ0U
16709,deu,"Beantworten Sie diese Frage, indem Sie die richtige Phase angeben.Alexandras Unternehmen wurde umstrukturiert. Dies führte zu Entlassungen unter den Führungskräften. So wurde Alexandra plötzlich Chefin eines Teams, das nicht mehr aus vier, sondern aus sieben Personen bestand. Die neuen Mitarbeiter in ihrem Team hatten Schwierigkeiten, sich an diese Veränderung zu gewöhnen. Alexandra erledigt ihre Aufgaben jedoch weiterhin so, wie sie es vor der Integration der neuen Mitarbeiter getan hat. In welcher Phase der Veränderungskurve befindet sie sich?",,11.0,connectsolutions_de,4. Die Veränderungsbereitschaft beurteilen,,77,2yepbESY8ozaTMSCZ90tdH
16710,deu,"Beantworte diese Frage, indem Sie das korrekte Zimmer benennen, auf welches die Beschreibung zutrifft.Die Firma, in der Karl arbeitet, wird verlegt, sein Arbeitsplatz ist direkt bedroht. Carl ist sich bewusst, dass er nach vorn schauen und eine andere Arbeit finden muss. Es fällt ihm jedoch schwer, eine Entscheidung zu treffen. Er fühlt sich nostalgisch, denkt an seine Situation vor der Bekanntgabe der Nachricht und seine Produktivität wird beeinträchtigt. In welchem Zimmer des Vier-Zimmer-Modells befindet er sich?",,11.0,connectsolutions_de,5. Die Veränderungsfähigkeit beurteilen,,76,38L4VnyyQjV8v1zEnCs5v0
16711,deu,"Beantworten Sie diese Frage, indem Sie die entsprechende Phase benennen:In welcher Phase befinden Sie sich, wenn Sie die Personen bestimmen, die für das Veränderungsprojekt verantwortlich sein werden?",,11.0,connectsolutions_de,11. Prozesse im eigenen Führungsbereich umsetzen,,27,2lMawB2icY1az09kjXyEnP
16712,deu,"Beantworten Sie diese Frage mit einem Satz:Was signalisiert eine Person, die Widerstand leistet, wirklich?",,11.0,connectsolutions_de,4. Die Veränderungsbereitschaft beurteilen,,14,48uyP1X5EAR9bbrEVFy6rc
16713,deu,"Beantworten Sie diese Frage, indem Sie die korrekte Methode benennen:Welche Kommunikationsmaßnahme würden Sie einführen, um die persönlichen Bedürfnisse der Personen nach zusätzlicher Unterstützung zu ermitteln?",,11.0,connectsolutions_de,2. Die Veränderung intern abschätzen,,25,1IYC6lu9pR67OaeS35etxy
16714,deu,"Beantworten Sie diese Frage, indem Sie die beiden wahrscheinlichsten Antworten angeben: Wenn das neue Projekt bei Alexandra zu großen Spannungen führt, welche zwei Reaktionen sind zu erwarten?",,11.0,connectsolutions_de,4. Die Veränderungsbereitschaft beurteilen,,27,1rqf14fS0819ffCNUXTWdJ
16715,deu,"Beantworten Sie diese Frage, indem Sie einen bestimmten Handlungstyp nennen. Wenn Karl seine Überzeugungskraft einsetzt, um ein Projekt zu bekommen, das ursprünglich für Alexandra bestimmt war, was tut er dann?",,11.0,connectsolutions_de,3. Gezielte Massnahmen ableiten,,30,34a5nwUmh2D8k3M8iEXs2p
16716,deu,"Beantworten Sie diese Frage, indem Sie die drei richtigen Antworten angeben (in alphabetischer Reihenfolge): Welche drei Bedingungen müssen erfüllt sein, damit sich das Verhalten im Rahmen einer Unternehmensumstrukturierung ändert?",,11.0,connectsolutions_de,2. Die Veränderung intern abschätzen,,29,3mRTfMFgVLaaXfqMPEGDrE
16717,deu,"Bitte geben Sie die richtige Antwort an:Mit welcher Kommunikationsmaßnahme informiert Alexandra ihre Teams über die Herausforderungen und die vielleicht unschöne Wahrheit, die auf sie zukommen?",,11.0,connectsolutions_de,7. Einen Veränderungsprozess gestalten,,25,4EAqcT9OWJL6OwOBcdo0Zl
16718,deu,"Nennen Sie ein Beispiel für eine Aufgabe, die mit der Rolle des Vermittlers verbunden ist.",,11.0,connectsolutions_de,5. Die Veränderungsfähigkeit beurteilen,,15,5B7IvMnJA997uZzZUYc4q0
16719,deu,"Beantworten Sie diese Frage, indem Sie die entsprechende Methode benennen:Welche Methode der aktiven Unterstützung und Begleitung würdest du einsetzen, damit die Mitarbeiter die Möglichkeit haben, die neu geforderten Fähigkeiten zu entwickeln?",,11.0,connectsolutions_de,7. Einen Veränderungsprozess gestalten,,31,70OkWK0n5Ih87Lx4aS3qgL
16720,deu,"Nennen Sie eine Maßnahme, mit der Veränderungsprozesse im Alltag verankert werden können.",,11.0,connectsolutions_de,3. Gezielte Massnahmen ableiten,,12,7ma3yrTCu7P6iLlPnJhivi
16721,deu,Nennen Sie ein Beispiel für einen technologischen Wandel im Transportwesen.,,11.0,connectsolutions_de,1. Veränderung auf der Basis der Umwelt abschätzen,,10,8mSuKNKNgRw874WzDcfDP0
16722,deu,"Beantworten Sie diese Frage: Wie nennt man die wiederholte Berichterstattung über Leistungen, die dank der Veränderung erzielt wurden?",,11.0,connectsolutions_de,5. Die Veränderungsfähigkeit beurteilen,,18,9UISn18Fsdaa8MYKDeJKgj
16723,deu,Bitte beantworten Sie diese Frage mit einem Stichwort: Welcher Form von Veränderung entspricht die Einrichtung einer unternehmensinternen Online-Kommunikationsplattform im Zusammenhang mit der COVID-19-Pandemie?,,11.0,connectsolutions_de,4. Die Veränderungsbereitschaft beurteilen,,23,aBBAjlpWQhI6j4mkG14spd
16724,deu,Nennen Sie ein Beispiel für eine Interessengruppe.,,11.0,connectsolutions_de,9. Massnahmen gegen Störungen einleiten,,7,aS9POJ8r2tn5TBgtUE99NL
16773,deu,Schreibe was du hörst auf Englisch.,,99.0,vocitrainer,,,6,75DBcPydjVB8VyijgpI0t3
16775,deu,Schreibe was du hörst auf Englisch.,,99.0,vocitrainer,,,6,a9UPGVFknIZaIK1ZLWcJrI
16777,deu,Schreibe was du hörst auf Englisch.,,99.0,vocitrainer,,,6,2LDUTpnIehiaJUu3lzsnUm
16779,deu,Schreibe was du hörst auf Englisch.,,99.0,vocitrainer,,,6,5okM7OScMI2aW4J7yWA0t1
16780,deu,Schreibe was du hörst auf Englisch.,,99.0,vocitrainer,,,6,1b3LtF6qPk46IQQvn92ZDF
16781,deu,Schreibe was du hörst auf Englisch.,,99.0,vocitrainer,,,6,9UVjOVuS8AM7z29wc6vnKq
16783,deu,Schreibe was du hörst auf Englisch.,,99.0,vocitrainer,,,6,a7nhdEsA3ry7gxErziK1wC
16787,deu,Schreibe was du hörst auf Englisch.,,99.0,vocitrainer,,,6,aC5pNYtvYOb6XDqvcq1dsu
16789,deu,Schreibe was du hörst auf Englisch.,,99.0,vocitrainer,,,6,1jluuI7cKY9azlSA8qBwp5
16794,deu,Schreibe was du hörst auf Englisch.,,99.0,vocitrainer,,,6,acX6e2WCFnY8RZQZUo2oNM
16796,deu,Schreibe was du hörst auf Englisch.,,99.0,vocitrainer,,,6,21TysdCki4A6FYErfE6Jm7
16797,deu,Schreibe was du hörst auf Englisch.,,99.0,vocitrainer,,,6,439dCH3rEZo8dSkoXrIdnG
16799,deu,Bitte übersetze den folgenden Satz auf Englisch.Der Hund ist sehr gross.,,99.0,vocitrainer,,,11,8v8OC6cd0qAa66JLdtMno4
16800,deu,ÜBERSETZE DEN FOLGENDEN TEXT AUF ENGLISCH:Wer bist du?,,99.0,vocitrainer,,,8,jF3KvGPCpo88N4XsmgfiC
16803,deu,Bitte übersetze den folgenden Satz nach Englisch.Heute ist super Wetter.,,8.0,demo,,,10,6X4DKMl84yL7pEr9wB1cI7
16805,deu,Schreibe was du hörst auf Englisch.,,99.0,vocitrainer,,,6,2GeReVvD3ee86OtWju4LOe
16812,deu,Bitte übersetze den folgenden Satz auf Englisch.There are books in the backgournd.,,8.0,demo,,,12,8RMqFbGWgL28hemdnKDrg5
16814,deu,Bitte übersetze den folgenden Satz auf Englisch. Wir entwickeln ein Programm.,,8.0,demo,,,11,3shkyRdtdfW61LGgGBtpeG
16822,deu,Please translate the following sentence to English: Das Mädchen umarmt einen Hund.,,8.0,demo,,,12,60ZdhA28i3390ftnNwdvb8
16825,deu,Bitte Übersetze folgenden Satz in Englisch: Wir sitzen vor dem Computer.,,8.0,demo,,,11,5LfUwEVQeAm6lN3Q0KJrpK
16831,deu,Translate the follwing sentence to Englisch: Er ist der neue Präsident von Amerika.,,8.0,demo,,,13,7mL05hysGcM6ZxzU7kBNjl
16834,deu,Bitte übersetze den folgenden Satz:Wir sitzen in einer Besprechung.,,8.0,demo,,,9,2tan3ENDl9Y9d2y80Bm5Kb
16841,deu,"Gib deine Antwort in Stichworten an.Was ist deiner Meinung nach eine Eigenschaft, die einem Leader helfen kann, mit seiner eigenen Sensibilität umzugehen?",,11.0,connectsolutions_de,4. Die Veränderungsbereitschaft beurteilen,,22,4pKkeNj3T6ZaUqdC7cefmS
16842,deu,"Beantworte diese Frage mit ZWEI Stichwörtern: Die meisten Veränderungsprojekte haben Auswirkungen auf zwei Ebenen, welche sind das deiner Meinung nach?",,11.0,connectsolutions_de,6. Die Veränderungsprozesse in den Wechselwirkungen beschreiben,,20,5uQBlerTLL09zTEJkjoY0P
16843,deu,"Nenne in wenigen Worten ein Beispiel für einen technologischen Wandel, der die Arbeitsmittel betrifft.",,11.0,connectsolutions_de,1. Veränderung auf der Basis der Umwelt abschätzen,,14,2SlBVhjmVIN9brWa5caXzs
16844,deu,"Nenne ein Beispiel für eine organisatorische Veränderung, die das Organisationsmodell betrifft.",,11.0,connectsolutions_de,3. Gezielte Massnahmen ableiten,,11,3PEjuP7EEn6a1U8sGBCKv8
16845,deu,"Beantworte diese Frage, indem du eine Beschreibung formulierst: Was ist die Erwartung an die Führungsrolle? (Nenne mindestens 1)",,11.0,connectsolutions_de,6. Die Veränderungsprozesse in den Wechselwirkungen beschreiben,,18,8qiNixePl585WRsLTvsO5L
16846,deu,"Beantworte diese Frage, indem du die entsprechende Kammer im Modell benennst, das der Beschreibung entspricht: Die Firma, in der Carl arbeitet, soll verlagert werden, sein Arbeitsplatz ist direkt bedroht. Carl ist sich bewusst, dass er nach vorn blicken und eine andere Arbeit finden muss, aber es fällt ihm noch schwer, sich zu entscheiden. Er erinnert sich nostalgisch an seine Situation vor der Bekanntgabe der Nachricht. Dies beeinträchtigt seine Produktivität.",,11.0,connectsolutions_de,5. Die Veränderungsfähigkeit beurteilen,,69,7niZcHw13T26fs05I4CQiX
16847,deu,"Beantworte diese Frage, indem du die Phase der Veränderungskurve benennst, in der sich Alexandra befindet: Alexandras Firma wurde umstrukturiert, was zu Entlassungen unter den Führungskräften führte. Dadurch war Alexandra von einem Tag auf den anderen nicht mehr Chefin eines vierköpfigen, sondern eines siebenköpfigen Teams. Die neuen Mitarbeiter in ihrem Team haben Schwierigkeiten, sich an diese Veränderung zu gewöhnen. Alexandra macht ihre Arbeit jedoch weiterhin so, wie sie es vor der Integration der neuen Mitarbeiter getan hat.",,11.0,connectsolutions_de,4. Die Veränderungsbereitschaft beurteilen,,76,4My3qZPpoD29iUxDtDEVQp
16848,deu,"Vervollständige diesen Satz mit drei Adjektiven: Wenn du dich in Schritt 3 des Kotter-Modells (Vision und Strategie entwickeln) befindest, muss die Vision ___________ sein.",,11.0,connectsolutions_de,7. Einen Veränderungsprozess gestalten,,24,2jnGAP7Hufw8aZUcKNJMc7
16849,deu,"Damit sich eine Bereitschaft zur Veränderung entwickelt, muss ein Gefühl der Dringlichkeit geschaffen werden. Dazu müssen die Verantwortlichen bestimmte Fragen beantworten können. Gib eine davon hier an:",,11.0,connectsolutions_de,11. Prozesse im eigenen Führungsbereich umsetzen,,27,5lqXRJhkFvMaTGrslIY6YY
16850,deu,"Beantworte diese Frage in einem vollständigen Satz: Welches Signal sendet eine Person, die Widerstand leistet, eigentlich aus?",,11.0,connectsolutions_de,4. Die Veränderungsbereitschaft beurteilen,,17,89qzhqauONB6K7kRLpV64m
16851,deu,"Beantworte diese Frage, indem du die Methode benennst: Welche Kommunikationsmaßnahme würdest du einführen, um die persönlichen Bedürfnisse der Personen nach zusätzlicher Unterstützung zu ermitteln?",,11.0,connectsolutions_de,2. Die Veränderung intern abschätzen,,24,DgC1xLQRqo95OXxMTuMjN
16852,deu,"Wie nennt man interne und externe Personengruppen, die direkt oder indirekt von den Aktivitäten des Unternehmens betroffen sind und daher ihre Interessen gegenüber dem Unternehmen geltend machen?",,11.0,connectsolutions_de,4. Die Veränderungsbereitschaft beurteilen,,27,aqldUKdUSre6kdvHuBrYt7
16853,deu,"Beantworte diese Frage, indem du eine bestimmte Art von Handlung angibst:Wenn Carl seine Überzeugungskraft einsetzt, um ein Projekt zu bekommen, das ursprünglich Alexandra gewidmet war, was tut er dann?",,11.0,connectsolutions_de,3. Gezielte Massnahmen ableiten,,29,1Khq1NcVb2T84UFefrMlqJ
16854,deu,"Beantworte diese Frage mit einem Wort: Welche Art von Veränderung stellt die Einrichtung einer Online-Plattform im Kontext der Coronavirus-Pandemie dar? Es handelt sich um eine revolutionäre, globale und ____ Veränderung.",,11.0,connectsolutions_de,4. Die Veränderungsbereitschaft beurteilen,,30,1MoRHyQX5pJ6OVL1qZqP6i
16855,deu,"Nenne eine Maßnahme, mit der Veränderungsprozesse im Alltag verankert werden können.",,11.0,connectsolutions_de,3. Gezielte Massnahmen ableiten,,11,2BEhOwnzxgT6prfp7BvxuZ
16856,deu,Nenne ein Beispiel für eine Interessengruppe.,,11.0,connectsolutions_de,9. Massnahmen gegen Störungen einleiten,,6,2XCZvkZWgxOaAr62HhDWR3
16857,deu,"Beantworte diese Frage, indem du BEIDE erwartete Antworten gibst: Wenn das neue Projekt bei Alexandra zu großen Spannungen führt, welche zwei Reaktionen sind möglich (eine eher positive und eine eher negative)?",,11.0,connectsolutions_de,4. Die Veränderungsbereitschaft beurteilen,,31,3FGpNp7eJHi75fsSSV17zn
16858,deu,Nenne ein Beispiel für eine technische Entwicklung im Transportwesen.,,11.0,connectsolutions_de,1. Veränderung auf der Basis der Umwelt abschätzen,,9,4unxe0YKsV57iyJC6yj14a
16859,deu,"Beantworte diese Frage, indem du die entsprechende Methode benennst: Welche Methode der aktiven Unterstützung und Begleitung würdest du einsetzen, damit die Mitarbeiter die neu geforderten Fähigkeiten entwickeln?",,11.0,connectsolutions_de,7. Einen Veränderungsprozess gestalten,,27,5F5z68DvGND93wql4U4JTo
16860,deu,Wie nennt man einen immer wieder durchgeführten Bericht über erfolgreiche Leistungen aufgrund von Veränderungen?,,11.0,connectsolutions_de,5. Die Veränderungsfähigkeit beurteilen,,14,5OD6pEEQ0Og74G6ac34ELo
16861,deu,"Nenne in einem Satz ein Beispiel für eine Aufgabe, die mit der Rolle des Vermittlers/des Facilitators verbunden ist.",,11.0,connectsolutions_de,5. Die Veränderungsfähigkeit beurteilen,,18,5UI7ddBqEUf9RzaFurONES
16862,deu,"Schreibe die richtige Antwort in Stichworten auf: Mit welcher Kommunikationsmaßnahme informiert Alexandra ihre Teams über die Herausforderungen und unangenehmen Hürden, die sie erwarten?",,11.0,connectsolutions_de,7. Einen Veränderungsprozess gestalten,,23,7h8f9nExZtt7r8M3Ccet2q
16863,deu,"Beantworte diese Frage, indem du die drei Antworten (in alphabetischer Reihenfolge) angibst: Welche drei Bedingungen müssen erfüllt sein, damit sich das Verhalten im Rahmen einer Unternehmensumstrukturierung ändert?",,11.0,connectsolutions_de,2. Die Veränderung intern abschätzen,,27,7lQ0BAuQLHG5SFqQxJkmm7
16864,deu,Welchen Vorteil hat BPR (Business Process Reengineering) im Vergleich zur Optimierung bereits bestehender Prozesse?Beantworte die Frage mit einem kurzen Satz.,,11.0,connectsolutions_de,,,20,2ocqg6L4oDYaTwlILJ60Pc
16884,deu,"Bitte antworten Sie mithilfe eines Stichworts.Es gibt eine Reihe von nonverbalen Signalen.Sie geben wichtige Informationen über den Beziehungsaspekt der Kommunikation.Manche Botschaften werden vom Empfänger mitunter als störend wahrgenommen, weil sie wenig authentisch oder vertrauenswürdig sind.  Hierbei handelt es sich um welche Art von Botschaften:",,11.0,connectsolutions_de,4. Setzen technische Kommunikationsmittel angemessen ein,,44,1XeceQVq7DP7L36W36dedb
16885,deu,"Bitte geben Sie Ihre Antwort mithilfe eines oder mehrerer Schlüsselwörter an.In einem Kritikgespräch, in dem es beispielsweise um ein Fehlverhalten oder eine ungenügende Leistung geht, muss ich als Führungskraft eine Kritik an meinem Mitarbeiter formulieren. Diese Kritik sollte, um möglichst konstruktiv zu sein, auf etwas sehr Wichtiges gerichtet sein, das durch Emotionen oft verzerrt wird und in die Subjektivität abdriftet.Worum geht es?",,11.0,connectsolutions_de,5. Verhalten sich in unterschiedlichen Gesprächssituationen klärend und angemessen,,62,2FRbuv73DKKakf72y9H90L
16888,deu,"Walter (28) ist Buchhalter Debitoren bei der Generaldirektion SBB in Bern. Nennen Sie einige Aufgaben sowie mögliche Kompetenzen und Verantwortung seiner Stelle.-----Taskbase Kommentar: Bei der folgenden Aufgabe handelt es sich um eine offene Aufgabe. Für die Aufgabe war keine Musterlösung hinterlegt. Taskbase hat die Aufgabe im besten Wissen, mit den vorhandenen Informationen aufgesetzt. Da keine Musterlösung vorhanden war ist es möglich, dass manche Antworten gemäss der Einschätzung von hep fehlen. Bei einer Zusammenarbeit würden diese didaktischen Diskussionen passieren. Der Feedbacktext soll dem Lernenden einen Hinweis geben, was eine korrekte Antwort sein könnte. Der Feedbacktext enthält keine Musterlösung.",,75.0,iterativ-sandbox,,,97,WQpEgyLgi089ljEf8PuJw
16889,deu,"Wie nennt man diese Variante der Organisation?-----Taskbase Kommentar:Bei dieser Aufgabe handelt es sich um eine Cloze Aufgabe, die mit einem Wort beantwortet werden kann. Für die Aufgabe war eine Musterlösung vorhanden, anhand welcher die Aufgabe aufgesetzt wurde. Das Feedback gibt dem Lernenden einen Hinweis auf die richtige Lösung, enthält die Musterlösung aber nicht.",,75.0,iterativ-sandbox,,,53,aqFM7iL1gxE8Nl9d5EwMZ7
16890,deu,"Warum wurde wohl diese Organisation gewählt?-----Taskbase Kommentar:Bei dieser Aufgabe handelt es sich um eine offene Aufgabe. Für die Aufgabe war eine Musterlösung vorhanden, anhand welcher die Aufgabe aufgesetzt wurde. Das Feedback gibt dem Lernenden einen Hinweis auf die richtige Lösung, enthält die Musterlösung aber nicht. Als Feedback ist ebenfalls hinterlegt, wenn der Lernende Grammatik- oder Rechtschreibfehler macht. Dies liegt allerdings in der Hoheit von hep und kann individuell auf eure didaktischen Anforderungen angepasst werden.",,75.0,iterativ-sandbox,,,74,5CFVvAUF1ql5IyB56TENAa
16891,deu,"Wie sind die Abteilungen organisiert?-----Taskbase Kommentar:Bei dieser Aufgabe handelt es sich um eine offene Aufgabe. Für die Aufgabe war eine Musterlösung vorhanden, anhand welcher die Aufgabe aufgesetzt wurde. Das Feedback gibt dem Lernenden einen Hinweis auf die richtige Lösung, enthält die Musterlösung aber nicht. Als Feedback ist ebenfalls hinterlegt, wenn der Lernende Grammatik- oder Rechtschreibfehler macht. Dies liegt allerdings in der Hoheit von hep und kann individuell auf eure didaktischen Anforderungen angepasst werden.",,75.0,iterativ-sandbox,,,73,3OSeZ6O83us8GUTd4pseaY
16904,deu,Beschreiben Sie anhand eines Beispiels aus Ihrer beruflichen Tätigkeit den Unterschied zwischen­ Eustress und Distress.,,11.0,connectsolutions_de,,,15,1wJ2BoVC0SE5WBXSwrrqfQ
16905,deu,"Sie wollen Ihre Chefin von den Vorteilen einer «stillen Stunde» überzeugen. Nennen Sie mindestens zwei Argumente, die dafürsprechen.",,11.0,connectsolutions_de,,,18,7ouD1dvJsVi8EBD2bRnKu7
16906,deu,"Tina sagt: «Manchmal habe ich Mühe mit der Prioritätensetzung oder gerate in die typischen Zeitfallen. Dann bin ich unzufrieden mit meinen Arbeitsergebnissen, was sich auch auf meine Motivation schlägt. Umso mehr bin ich überzeugt, dass es sich lohnt, bei der Zeitplanung konkrete Ziele zu setzen. Sie motivieren nicht nur, sondern erleichtern auch die Zeitkontrolle, die wiederum einen positiven Effekt auf die persönliche Zeitplanung hat. Zudem stelle ich fest: Je motivierter ich bin, desto weniger Zeit brauche ich für das Erledigen von Aufgaben. Ich bin dann einfach effizienter!»Stellen Sie Tinas Aussage über die Zeitplanung in einem Problemnetz dar.Halten Sie alle relevanten Einflussfaktoren fest, die Wirkungsrichtung zwischen den Einflussfaktoren in Form von Pfeilen und die Wirkungsart durch «+» und «–».Ergänzen Sie Ihr Problemnetzwerk wo nötig mit weiteren bedeutenden Einflussfaktoren oder Wirkungen.",,11.0,connectsolutions_de,,,129,58KeFv8KBkG6biUL2vMAC7
16907,deu,"Ein bekanntes Sprichwort lautet: «Was ich nicht weiss, macht mich nicht heiss!»Beschreiben Sie anhand eines Beispiels, was dieses Sprichwort für den effizienten Umgang mit Informationen bedeuten könnte.",,11.0,connectsolutions_de,,,27,8fF4acPIaga8B8p612RCko
16908,deu,"Drei Freunde unterhalten sich über den Stress bei der Arbeit. Welche Stressoren sprechen sie in ihren Schilderungen an?A. Jonas: «Manchmal habe ich das Gefühl, ich sei der Depp vom Dienst, wie man so schön sagt! Ich helfe meinen Teamkollegen ja wirklich gerne aus, aber in letzter Zeit landen immer mehr Pendenzen auf meinem Tisch. Ich bin selbst schuld, ich kann einfach weniger gut Nein sagen als andere!»B. Didier: «In meinem Job bist du ständig auf Achse, das gefällt mir. Aber mit zunehmendem Alter scheine ich die jeweiligen Zeitumstellungen immer schlechter wegzustecken, und deshalb empfinde ich die vielen Flüge nach Amerika und in den Fernen Osten mittlerweile wirklich als stressig.»C. Simon: «Die für unsere Branche angekündigte Entlassungswelle hat nun auch unser Unternehmen erfasst. Ich darf gar nicht daran denken, dass auch ich davon betroffen sein könnte, ausgerechnet jetzt, wo wir endlich unseren Traum vom eigenen Haus verwirklichen konnten! So gebe ich im Moment alles für meinen Job und leiste entsprechend viele Überstunden.»",,11.0,connectsolutions_de,,,161,9KWNJE2Ujke6rONsMRRyQL
